,Date,changed,title,details,news_score,news_result,average
188,2018-03-20,41.58,Amazon Key gets fingerprint authentication,"
        Amazon (NASDAQ:AMZN) Key now includes fingerprint authentication on the Android version of the app.               Key allows Amazon drivers to drop off packages inside a home using a smart door look. A home security camera captures images of the delivery driver as a safety precaution.                The Key devices work in tandem with an app, which lets the user lock or unlock the door and check the camera footage. Fingerprint authentication prevents others from accessing those features.  Previously: Goldman Sachs: Amazon could hit $1,900 this year (March 20) ",0.9286,positive,0.8167534523809524
189,2018-03-20,41.58,"Goldman Sachs: Amazon could hit $1,900 this year","
                      Goldman Sachs says Amazon (NASDAQ:AMZN) shares could “easily” hit up to $1,900 this year, which is $75 higher than the firm’s last price target for the tech giant.               The higher target would represent a 23% upside to yesterday’s close.                Analyst Heath Terry tells CNBC that Amazon still has the potential for upsides particularly from Amazon Web Services and a continuing shift towards online retail sales.                Terry says the firm continues to think estimates for cloud and retail are too low.                Amazon shares are up 1.3% to $1,565.12.  Previously: Reuters: Amazon pushing merchants for cross-border sales (March 20) ",0.9611,positive,0.8167534523809524
190,2018-03-20,41.58,BofAML survey: Tech longs 38% overweight last month,"
        Bank of America Merrill Lynch’s latest monthly survey shows that investors were heavily exposed to tech shares.               Long investors in the tech sector were the No. 1 crowded trade with a net 38% overweight. Short dollar positions were 17% overweight.                Top investments were in the FAANG stocks (FB -2.8%), (AMZN +1.6%), Apple (AAPL +0.5%), Netflix (NFLX +1.7%), and Alphabet (GOOG -0.1%) and the BAT stocks, which includes Baidoo, Alibaba (BABA +1.9%), and Tencent (OTCPK:TCEHY +2.4%).                The survey included fund managers running $579B worldwide and was conducted from March 9 to March 15.  Related ETFs: XLK, VGT, SOXL, FDN, SOXX, SMH, GGT, TECL, FTEC, USD, VOX, IYW, PSI, TDIV, ROM, XSD, QTEC, IYZ, IGV, RYT, SOXS, FNG, TECS, IGM, PSCT, FCOM, FXL, PBS, XNTK, XTL, REW, IGN, PSJ, SSG, PTF, PXQ, XSW, FTXL, LTL, JHMT, XWEB, XITK, TCHF, XTH, TECZ, XK, FNGD, FNGU ",-0.7098,negative,0.8167534523809524
191,2018-03-20,41.58,Reuters: Amazon pushing merchants for cross-border sales,"
 Reuters reports that Amazon (NASDAQ:AMZN) is pushing its merchants to sell into other countries to better compete with eBay (NASDAQ:EBAY) and Alibaba (NYSE:BABA).               Amazon rents space in over 150 warehouses around the world to store merchandise near customers and avoid exporting items individually.                Amazon VP Eric Broussard says more than a quarter of seller revenue last year was from cross-border transactions, which was up over 50% on the year to roughly $50B to $75B (based on analyst estimates.)                   Competitor eBay plans to expand into Japan as part of its global expansion while Alibaba recruits companies to sell in China.                   Amazon shares are up 0.5% premarket to $1,553.     Previously: Amazon to buy some Toys 'R' Us locations? (March 20) ",0.9628,positive,0.8167534523809524
192,2018-03-20,41.58,Amazon to buy some Toys 'R' Us locations?,"
Amazon (NASDAQ:AMZN) has looked at the possibility of expanding its retail footprint by acquiring some locations from bankrupt Toys ""R"" Us, according to Bloomberg.A deal would come on the heels of its Whole Foods acquisition and opening its own line of bookstores and a convenience-store concept.In 2015, Amazon held similar discussions about acquiring some locations from bankrupt RadioShack, but nothing came of the talks. ",0.1882,positive,0.8167534523809524
193,2018-03-14,2.82,Amazon launches first debit card in Mexico,"
Amazon (NASDAQ:AMZN) has launched its first-ever debit card in Mexico as the local e-commerce sector gains in popularity.""Clients that don’t have a credit or debit card will find Amazon Rechargeable an easy and practical way to convert cash into a payment method,"" said Fernando Ramirez, Amazon's product manager in Mexico.Less than a third of adults in Mexico have credit cards, according to a 2017 government report. ",0.9269,positive,0.8167534523809524
194,2018-03-14,2.82,Walmart goes big into grocery delivery,"
Walmart (NYSE:WMT) is expanding its online grocery delivery service to a total of 100 metropolitan areas by the end of the year, up from six currently, a push that will help the retailer reach 40% of American households.Orders will be packed by Walmart employees before they are handed off to a delivery company or startup, a costly model it previously resisted as Amazon (NASDAQ:AMZN), Kroger (NYSE:KR) and Target (NYSE:TGT) invest in similar services. ",0.9392,positive,0.8167534523809524
195,2018-03-12,19.5,"Amazon roundup: Alexa goes to work, Amazon strengthens Vietnam push","
        Amazon (NASDAQ:AMZN) CTO Werner Vogels tells Axios that Alexa will soon come to a variety of business settings to help the voice assistant learn different types of conversations.               The previously announced Alexa for Business will include several parts including integrating the voice assistant into enterprise software and customizable skills.                Early Alexa for Business partners include Concur and Salesforce on the tech side and WeWork, CapitalOne, and Wynn hotels among the participating businesses.                   Vogels insists that Alexa for Business doesn’t interfere with the partnership with Microsoft’s Cortana, even though it steps into Microsoft’s enterprise territory.                   In other Amazon news, the company teams up with Vietnam E-commerce Association (VECOM) for a stronger push into the Vietnamese market.                Amazon is expected to release its official plans for the region on March 14 at the Vietnam Online Business Forum, but partnering with VECOM will give Amazon better access to products and local small and medium-sized businesses to list on the platform.                Amazon currently lags behind Alibaba, which got a head-start in the region.                Amazon shares are up 1.1% to $1,595.86.   ",0.9751,positive,0.8167534523809524
196,2018-02-28,0.47,Amazon might have the OS of future retail,"
 Loup Ventures thinks that Amazon (AMZN +0.5%) could be sitting on the ""operating system of automated retail"" with the Amazon Go concept, along with AWS (Amazon Web Services) and FBA (Fulfillment by Amazon) at the ready. In one of the more riveting pieces on Amazon's future disruption on retail, analyst Andrew Murphy explains why the Seattle e-commerce giant is in the pole position in the $50B (market potential) automated retail industry. Murphy on AMZN: ""Just as Amazon did with FBA and, to a lesser extent, AWS, Amazon is initially building a backend infrastructure for its own use with Amazon Go. And just like FBA and AWS, that infrastructure gets more valuable as it scales. The Amazon Go backend gives the company a trojan horse into the brick and mortar retail space, clearly an area of interest given the Whole Foods acquisition. Perhaps the more critical question is why a retailer would work with Amazon? Our answer is the same as it is with all of Amazon’s best offerings: convenience. Retailers would have a turnkey solution for automated retail. While larger stores like Walmart and Target may not want to use the technology for competitive reasons, branded retail stores (like a Nike store) may be a fit if Amazon can create a product that helps save the retailer labor and processing costs.""Related stocks: WMT, TGT, NKE, GPS, LB, SPLS, FL, FINL, ANF, EXPR, URBN, ULTA, FIVE.  ",0.9945,positive,0.8167534523809524
197,2018-02-28,0.47,Amazon Prime Music comes to India; Alexa skills get more rewards,"
        Amazon (NASDAQ:AMZN) launches its Amazon Prime Music service in India. Local competitors include Apple Music and Tencent-backed Gaana.               The service comes free with Prime memberships, which cost about $15.30 annually in the region.                India’s online retail market is expected to hit $200B in the next decade. Amazon committed to investing $5B in the market to battle competitor Flipkart. Skills rewards: Amazon expands its rewards program for developers making popular Alexa skills.                The program initially only included game developers then extended to limited other categories, but now Amazon will reward those developing the top skills for kids.                Other covered categories: Education & Reference, Food & Drink, Health & Fitness, Lifestyle, Music & Audio, and Productivity.                Amazon says it has paid out “millions of dollars” to developers in 22 countries and that some earn “tens of thousands of dollars.”                Amazon shares are up 0.9%.  Previously: Axios: Amazon will acquire video doorbell startup Ring (update) (Feb. 27)Previously: Recode: Amazon selling UFC pay-per-view packages (Feb. 28) ",0.9901,positive,0.8167534523809524
198,2018-02-28,0.47,Recode: Amazon selling UFC pay-per-view packages,"
 Recode reports that Amazon (NASDAQ:AMZN) will start selling UFC pay-per-view packages. Terms not disclosed.               You buy the package straight from Amazon and don’t need a Prime account but can watch the fights on any platform you can watch Prime.                The $64.99 deal, which goes on sale starting today, marks the first time Amazon has sold live sports pay-per-view packages.                Amazon shares are up 0.7% premarket.  Previously: Axios: Amazon will acquire video doorbell startup Ring (update) (Feb. 27) ",0.9498,positive,0.8167534523809524
199,2018-02-26,21.95,Berkshire-Amazon-JPMorgan healthcare venture more than just pricing power - Buffett,"
In an interview with CNBC, Warren Buffett said the healthcare joint venture between Berkshire, Amazon and JPMorgan is ""far more ambitious"" than just leveraging negotiating strength to shave 3 - 4% off costs. Its goal is to deliver better care for less money, an objective that he cautions will ""take time,"" adding that one objective is to stop the increase in share of the U.S. economy occupied by healthcare spending.The venture, currently managed by Berkshire's Todd Combs, JPMorgan's Marvelle Sullivan Berchtold and Amazon's Beth Galetti, expects to have a CEO on board within a year.ETFs: GRX, THW, BME, IXJ UNH ANTM AET CNC MOH CVS XLV WBA AMZN JPM BRK.A ",0.9823,positive,0.8167534523809524
200,2018-02-26,21.95,"GBH Insights ups Amazon target to 23% upside, $1T valuation","
        GBH Insights raises its Amazon (NASDAQ:AMZN) price target from $1,500 to $1,850, which is a 23% upside to Friday’s close and would represent an over $1T valuation in 12 to 18 months.               Analyst Dan Ives says the Prime membership moat is “gaining further steam in the field, and the Amazon ‘flywheel effect’ is further playing out globally among consumers.”                Ives calls Amazon’s consumer retail growth and AWS the “1-2 punch” backed by the Whole Foods tailwinds and the recent healthcare push.                Amazon shares are up 1.1%.   ",0.9492,positive,0.8167534523809524
201,2018-02-22,2.42,Recode: Amazon planning six more Go stores this year,"
 Recode reports that Amazon (AMZN +0.7%) will open as many as six additional Amazon Go stores this year.  Sources say some of the stores will open in Seattle and Los Angeles.  A Los Angeles Go could come to the 600K square-foot outdoor shopping center The Grove.  The first Go, which offers a cashier-free shopping experience, opened in Seattle last month.    Go shoppers scan a phone when entering and are automatically charged through a mobile payment system on the way out with no need to stop at a register.  Grocery-related stocks that could move on the news:(APRN -1.2%), (SVU -1%), (WMK -1.2%), (KR -0.8%), (IMKTA -0.2%), (SFS -1.2%), (CASY).   ",0.7603,positive,0.8167534523809524
202,2018-02-21,14.57,"Amazon closes up after crossing $1,500 for first time","
        Amazon (NASDAQ:AMZN) shares closed up 1% after hitting a new high during the day.          Amazon shares hit $1,503.49 (first time crossing that $1.5K line) before dropping back down to the closing price of $1,482.92. Previously: Amazon roundup: New accelerator, over double Walmart's size, Luxoft collab (Feb. 21) ",0.8717,positive,0.8167534523809524
203,2018-02-21,14.57,"Amazon roundup: New accelerator, over double Walmart's size, Luxoft collab","
Amazon (NASDAQ:AMZN) launches a 13-week Alexa Accelerator backed by its Alexa Fund.The accelerator will select up to 13 early-stage startups that will receive an undisclosed investment from the fund.Amazon hopes to expand the Alexa ecosystem with the startups.This marks the second Accelerator with the first, which has an international expansion focus announced last November with a $100M total investment.Rollback prices: Amazon is now worth 2.5 times as much as Walmart thanks to Walmart dropping 5.5% this week after reporting weak holiday e-commerce sales.Blockchain:                   Luxoft (NYSE:LXFT) announces it’s collaborating with Amazon Web Services to enable enterprise blockchain adoption and Distributed Ledger Technologies.Luxoft shares are up 4.6%.Previously: Amazon +1.7% on target increase to 19% upside (Feb. 21) ",0.9858,positive,0.8167534523809524
204,2018-02-21,14.57,Amazon +1.7% on target increase to 19% upside,"
        MKM Partners maintains a Buy rating and raises its Amazon (NASDAQ:AMZN) price target from $1,350 to $1,750, a 19% upside to yesterday’s close.               Analyst Rob Sanderson calls Amazon “the best growth story of all the mega-caps over the very long term.”                MKM ups its 2022 EPS estimate from $66 to $78.                  Amazon shares are up 1.7% to $1,493.27 with a 52-week range of $833.50 to $1,498.        ",0.9357,positive,0.8167534523809524
205,2018-02-20,19.66,Amazon offering 5% back on Whole Foods purchases,"
        Amazon (NASDAQ:AMZN) Prime members with the company’s Rewards Visa card can now get 5% back on Whole Foods purchases.               This marks the first time Amazon offered a 5% back perk to a retailer outside its own e-commerce platform. Amazon acquired Whole Foods last year.                Non-Prime members with the card will get 3% back.                Amazon shares are up 1.2%.  Previously: The Information: Amazon offered $100M for August before releasing Key (Feb. 20) ",0.9535,positive,0.8167534523809524
206,2018-02-20,19.66,The Information: Amazon offered $100M for August before releasing Key,"
        Amazon (NASDAQ:AMZN) offered $100M to buy smart lock maker August Home in 2016, according to The Information.               The previously unreported offer was mentioned in a piece about Amazon’s Alexa Fund investing in companies in markets that Amazon later decides to enter.                August turned down the offer and later sold for $150M to lock manufacturer Assa Abloy. The sale came after Amazon announced its competing Key product.                Amazon participated in a $5.6M funding round for Nucleus, creator of Alexa-integrated home intercoms with screens. Amazon later released the Echo Show.                Amazon denies the claims and says the Echo Show was “well underway before our first discussion with Nucleus.”   Amazon shares are up 1.4%.     ",0.956,positive,0.8167534523809524
207,2018-02-15,10.71,Yahoo Finance: Amazon plans to combine AmazonFresh and Prime Now,"
        The layoffs at Amazon (NASDAQ:AMZN) HQ come as the company works to consolidate its Amazon Prime Now and AmazonFresh businesses, according to Yahoo Finance sources.               Prime Now offers two-hour delivery for Prime members in certain areas. AmazonFresh offers grocery delivery (in certain areas) at an additional membership fee of $14.99/month.                The consolidation could streamline the delivery experience for the Whole Foods side of the business.                Amazon had already begun scaling back the AmazonFresh presence shortly after the Whole Foods acquisition.                Amazon shares are up 0.88%.  Previously: Recode reports Amazon blames USPS for Fresh failures; Amazon Go soon public? (Nov. 15, 2017)Previously: Seattle Times: Amazon cutting several hundred HQ jobs (Feb. 12) ",0.9805,positive,0.8167534523809524
208,2018-02-15,10.71,Amazon making a splash in apparel,"
 Amazon (AMZN +0.4%) is making a huge splash in the apparel industry on the strength of strong interest from Prime members, according to new research. Retail Dive notes that in separate consumer surveys around 50% of all respondents indicated that they have recently purchased apparel off the e-commerce site. The surveys also tipped growing popularity for Amazon's private-label offerings. Target (TGT +0.2%), Macy's (M +1.8%) and Walmart (WMT +0.7%) are all believed to have lost some online apparel market share to the growing Amazon Fashion platform, especially with shoppers aged 18 to 29.  ",0.9817,positive,0.8167534523809524
209,2018-02-15,10.71,"Amazon to add 2,000 jobs in France","
Amazon (NASDAQ:AMZN) will create 2,000 permanent contract positions this year in France, its largest market in Europe after Britain and Germany.That will bring its total number of permanent local staff to 7,500 after investing over €2B in France since 2010.Separately, CNBC has disclosed that the tech giant partnered with BofA (NYSE:BAC) on Amazon Lending, a program that provide loans for small businesses that sell on Amazon.com. ",0.7143,positive,0.8167534523809524
210,2018-02-14,36.54,"JPMorgan's Dimon on healthcare venture: ""We believe we can do better""","
In interview with Business Insider's Matt Turner, JPMorgan (JPM +2.2%) CEO Jamie Dimon said the reason that his company is teaming up with Warren Buffett's Berkshire Hathaway (BRK.A +1.2%) and Jeff Bezos' Amazon (AMZN +2.4%) in a non-profit healthcare venture is to ""do it better"" at a lower cost, citing the 17% chunk of the U.S. economy occupied by the sector.He says JPMorgan spends $1.5B per year on medical care since it is self-insured so his organization is already making medical decisions on costs and services.He cites promising areas such as patient-directed health data via smartphones and a greater emphasis on preventative care and wellness, adding that smoking- and obesity-related care account for ~25% of healthcare costs. ",0.9873,positive,0.8167534523809524
211,2018-02-14,36.54,New stakes at Tiger Global disclosed,"
 Tiger Global updates on its Q4 portfolio actions. Top new buys: CRM, SWCH, CTRP, REDU, QD, SOGO, MDB. Top exited positions: AWI, WB, ROKU, ATUS, JMEI, RYB.The hedge fund founded by Julian Robertson also lowered its stakes in high flyers Netflix (NFLX +3.8%), Alibaba (BABA +3.7%) and Amazon (AMZN +2.1%) - while adding more shares of New Oriental (EDU +3.6%) and Apollo Global Management (APO +1.3%). Sources: SEC Form 13F and Bloomberg  ",0.9102,positive,0.8167534523809524
212,2018-02-14,36.54,Report: Facebook aiming for July release of two smart speakers,"
 Facebook (FB +2.3%) is targeting July for the launch of two smart speakers, according to a DigiTimes report. That's reportedly pushed later than an originally planned May release, so that Facebook can work on sound quality and software modification. The speakers are code-named Aloha and Fiona; while Aloha is more sophisticated, each one will have a 15-inch touch screen a la Amazon's (AMZN +1.6%) Echo Show (though the Show has a smaller 7-inch touch screen) and promise video chat and social features as a way to stay in touch. The Aloha model will be marketed under the name Portal and use voice commands along with facial recognition to access Facebook, according to the report. Amazon's Echo Show lists for $229.99 and is currently on sale for $179.99.Previously: Buy the dip now, says Facebook bull (Feb. 14 2018)  ",0.95,positive,0.8167534523809524
213,2018-02-13,28.28,Med supply stocks drop as Amazon preps an entry,"
        Amazon (NASDAQ:AMZN) spoke with hospital executives to tailor its Amazon Business service for medical supplies, according to the WSJ.               Amazon sent employees to a “large Midwestern hospital system” for a pilot program testing if officials can use Business to order health-care supplies for the system’s 150 outpatient facilities.                The program was customized for that system’s needs to allow for price comparisons between current distributors and Amazon Business.                Hospitals typically negotiate and sign contracts to buy supplies directly from manufacturers or distributors. Group-purchasing companies can also negotiate on behalf of multiple hospitals to leverage demand.                Fees, administration, marketing, and shipping costs account for up to 30% of health-care supply costs, according to Citigroup Global Markets data.                Healthcare distributors and group purchasers moving on the news: Cardinal Health (NYSE:CAH) down 3.7% premarket, Walgreens Boots Alliance (NASDAQ:WBA) down 1.8%, Owens & Minor (NYSE:OMI) down 4.5%,  McKesson (NYSE:MCK) down 4%; Henry Schein down 5.5%.                Amazon shares are down 0.4%.         Previously: Amazon, JPMorgan, and Berkshire Hathaway launching a healthcare company (Jan. 30) ",0.9866,positive,0.8167534523809524
214,2018-02-12,46.63,Seattle Times: Amazon cutting several hundred HQ jobs,"
           Amazon (NASDAQ:AMZN) will cut several hundred jobs in Seattle, according to The Seattle Times sources.            ”Hundreds” more will be laid off elsewhere in the tech giant’s global operations including at self-publishing unit Createspace and footwear seller Zappos.   The layoffs primarily focus on the consumer retail business. Insiders say rapid growth left some units over budget and overstaffed.  Amazon broadly addresses the cuts in a statement: “As part of our annual planning process, we are making head count adjustments across the company – small reductions in a couple of places and aggressive hiring in many others.”  Amazon shares are up 2.7%.Previously: The Information: Amazon plans to develop AI chips (Feb. 12) ",0.7946,positive,0.8167534523809524
215,2018-02-12,46.63,The Information: Amazon plans to develop AI chips,"
        Amazon (AMZN +0.9%) plans to become an AI chipmaker, according to The Information sources.               The chips would let Alexa devices respond faster to commands and are in development using tech brought in with the $350M acquisition of Israeli chipmaker Annapurna Labs three years ago.                Last December’s Blink acquisition brought more chip-making tech to Amazon. The startup was founded as Immedia Semiconductor and built chips for low-power video compression.                Amazon Web Services might be working on an AI chip for data centers.   Amazon shares are up 0.9%.    Previously: Amazon paid $90M for Blink technology (Feb. 12) ",0.934,positive,0.8167534523809524
216,2018-02-12,46.63,Amazon paid $90M for Blink technology,"
Amazon (NASDAQ:AMZN) paid about $90M to buy the maker of Blink home security cameras late last year, in a bet on the startup's energy-efficient chips, sources told Reuters.Analysts had thought the deal related to smart delivery program Amazon Key, but it may have centered on lowering production costs and lengthening the battery life of the Amazon Cloud Cam and Echo speaker.Blink says its cameras can last two years on a single pair of AA lithium batteries. ",0.7836,positive,0.8167534523809524
217,2018-01-30,20.14,Amazon Alexa can now send app-free text messages,"
           Amazon’s (NASDAQ:AMZN) Alexa can now send text messages to a contact in the user’s smartphone.  Right now, the service only works for U.S. users with a phone running the Android operating system.  Alexa was previously able to send text messages through the Alexa app but that required both parties to have the app.    Previously: Amazon, Berkshire Hathaway and JPMorgan to team up in healthcare venture (Jan. 30) ",0.9347,positive,0.8167534523809524
218,2018-01-30,20.14,"Amazon, JPMorgan, and Berkshire Hathaway launching a healthcare company","
        Amazon (NASDAQ:AMZN), JPMorgan (NYSE:JPM), and Berkshire Hathaway (BRK.A, BRK.B) are partnering up to form a healthcare company.               The new company will use the scale and expertise of the founders to provide affordable healthcare coverage for their U.S. employees.                The initial focus will be on tech solutions that will give employees and their families transparent and understandable healthcare.          The healthcare company is still in the planning stages and currently in the hands of Berkshire Hathaway investment officer Todd Combs, JPMorgan Managing Director Marvelle Sullivan Berchtold, and Amazon SVP Beth Galetti.               Longer-term management team, headquarter location, and more operational details will be announced at a later date.                Amazon shares are up 0.5% premarket.  Previously: Analyst raises Amazon to 14% upside on ad growth potential (Jan. 29) ",0.9811,positive,0.8167534523809524
