,Date,changed,title,details,news_score,news_result,average
631,2015-05-21,7.77,Amazon +2.6%; Morgan Stanley hikes target to $520,"

Two weeks after Bernstein hiked its Amazon (NASDAQ:AMZN) target to $600, Morgan Stanley's Brian Nowak has hiked his target by $70 to $520.
Nowak thinks 2016 Street gross profit estimates are 5% too low given recent margin growth and ongoing wallet share gains; he estimates gross profit/customer will rise 7% next year. In addition, fulfillment costs/unit are falling for the first time since 2010, as Amazon slows its warehouse-building binge. Nowak sees Amazon once more stepping up its fulfillment spend in 2016, but nonetheless believes its 2016 CSOI will be 5% above consensus.
Also: 1) Nowak believes Amazon's international losses are smaller than believed. However, a $269M 2015 international loss is still expected due to a strong dollar and Indian investments. 2) Nowak joins a chorus of analysts praising Amazon's Q1 AWS figures, while ""conservatively"" forecasting AWS' op. margin will fall 100 bps next year to 16% (he thinks the Street is modeling a 190 bps drop).
Shares are $17 away from a high of $452.65 (set after last month's Q1 report), and up 40% YTD.

Update: In other Amazon news, the company has announced its Prime Now 1-hour delivery service will start delivering goods from local stores in Manhattan. Amazon plans to expand the service to other locales later this year.
 ",0.991,positive,0.8167534523809524
632,2015-05-21,7.77,Goldman updates list of most-held hedge fund names,"

New additions to Goldman's hedge fund hotels - 50 stocks which most frequently appear among the largest ten holdings of hedge funds: AerCap (NYSE:AER), Assured Guaranty (NYSE:AGO), Baker Hughes (BHI), Citizens Financial (NYSE:CFG), Colony Capital (NYSE:CLNY), Dresser-Rand (NYSE:DRC), Family Dollar (NYSE:FDO), Hospira (NYSE:HSP), Netflix (NASDAQ:NFLX), NXP Semi (NASDAQ:NXPI), Pharmacyclics (NASDAQ:PCYC), Visa (NYSE:V), and Walgreens (NASDAQ:WBA).
Since 2001, the basket has outperformed the S&P 500 in 66% of quarters by an average of 73 basis points. YTD, however, it has underperformed by nine bps. Goldman notes the current basket overweights Consumer Discretionary (22%) and underweights Consumer Staples (2%).
Looking at the full list, Actavis (NASDAQ:ACT) leads the way, with 77 funds naming the stock as a top 10 holding. Next up is Apple (NASDAQ:AAPL) with 69, then Facebook (NASDAQ:FB) at 42. For the entire list of 50, the average is 26 funds making a stock a top 10 holding.
The rest in order: Valeant (VRX), Microsoft (NASDAQ:MSFT), DirecTV (NYSE:DTV), Citigroup (NYSE:C), Time Warner (TWC), Delta (NYSE:DAL), Cheneire (NYSEMKT:LNG), Yahoo (YHOO), Liberty Global (NASDAQ:LBTYK), AIG, SunEdison (SUNE), Air Products (NYSE:APD), Amazon (NASDAQ:AMZN), GM, BofA (NYSE:BAC), JPMorgan (NYSE:JPM), Macquarie Infrastructure (NYSE:MIC), American Airlines (NASDAQ:AAL), Charter Communications (NASDAQ:CHTR), Google (GOOG, GOOGL), Ally Financial (NYSE:ALLY), NorthStar Realty (NRF), Priceline (PCLN), eBay (NASDAQ:EBAY), MasterCard (NYSE:MA), Alibaba (NYSE:BABA), Micron (NASDAQ:MU), Williams (NYSE:WMB), Gilead (NASDAQ:GILD), Berkshire Hathaway (BRK.A, BRK.B), Dolar General (NYSE:DG), NorthStar Asset (NSAM), Brookdale Senior (NYSE:BKD), DISH Network (NASDAQ:DISH).
See also: Goldman updates list of hedge funds most-shorted stocks (May 21)
 ",0.988,positive,0.8167534523809524
633,2015-05-21,7.77,Another Amazon Prime competitor on deck?,"

eBay (NASDAQ:EBAY) is testing an Amazon (NASDAQ:AMZN) Prime-like program in Germany that it plans to roll out more broadly in the country later this year, although it's still not clear if it would introduce the service elsewhere.
The offering, known as eBay+, promises free, fast shipping and returns for customers who, according to local press in Germany, pay €15 to €20 a year.
Related: Wal-Mart details its Amazon Prime rival: $50/year unlimited shipping (May. 13 2015)
 ",0.9254,positive,0.8167534523809524
634,2015-05-20,2.15,CIRP: Amazon has 41M U.S. Prime subs,"

A survey from research firm CIRP suggests Amazon's (NASDAQ:AMZN) U.S. Prime subscriber base has risen by a modest 1M since the end of 2014 to 41M (an estimated 42% of Amazon's total U.S. customers). The firm notes growth was limited by users cancelling subscriptions following a 30-day free trial holiday season promo - in December, Amazon said it added over 10M new Prime users during the holiday season.
CIRP also estimates U.S. Prime subs are currently spending at an $1,100/year run rate, down from $1,500 during the holiday season - some doubts exist about those numbers. 34% of U.S. Amazon customers are believed to own a Kindle tablet or e-reader.
Amazon remains unwilling to disclose its Prime sub count, though it has stated Prime subs rose 53% globally and 50% in the U.S. in 2014. RBC estimated last September Prime had 30M-40M U.S. and 40M-50M total subs At the full $99/year rate (many users still get discounts), 41M subs would yield $4.06B in annual revenue.
CIRP's numbers come a week after Wal-Mart announced it plans to launch a $50/year Amazon Prime rival. Wal-Mart's service will promise delivery in 3 days compared with Prime's 2, and won't (initially at least) come with content services such as Prime Instant Video, Music, and Photos.
 ",0.9888,positive,0.8167534523809524
635,2015-05-14,5.41,Talk picks up over grocery chain consolidation,"
 Consolidation in the grocery industry could pick up even more, observes Supermarket News. A large merger between Albertsons and Safeway (NYSE:SWY) has been followed by talks between Delhaize (DEG) and Ahold (AHONY).
The increased push by Wal-Mart and Target in the sector has added pressure to leverage store growth through M&A. ""There is mounting pressure in the supermarket industry to consolidate operations to drive better purchasing power and leverage distribution and technology platforms,"" notes Wolfe Research.
Kroger (NYSE:KR) is seen as a likely candidate to look for a chain to acquire.
Previously: Ahold, Delhaize confirm merger talks (May 12)
Grocery stocks: RNDY, SVU, VLGEA, WFM, CASY, IMKTA, OTC:PUSH, TFM, SFM, WMK.  ",0.952,positive,0.8167534523809524
636,2015-04-24,55.11,"Amazon +15%; 3 upgrades arrive, JPMorgan values AWS at $66B","

Janney, JPMorgan, and Raymond James have upgraded Amazon (NASDAQ:AMZN) after the company beat Q1 estimates on the back of a 24% Y/Y increase in North American segment revenue, guided in-line, and (importantly) reported AWS had a $265M Q1 op. profit on revenue of $1.57B ($680M and $5.16B for the trailing 12 months). At least 7 other firms have hiked their targets. Amazon's market cap is at $181.6B.
JPMorgan's Doug Anmuth (upgrade to Overweight, $535 target) now values AWS at $66.3B, or 16x estimated 2016 EBITDA. ""[W]e think the reported profitability level far exceeded virtually all expectations. CSOI margins of 17% in 1Q15 and 14% in 2014 have been driven by increasing scale and greater utilization, along with additive services beyond core EC2 and S3 [computing and storage] services. When factoring in heavy depreciation, AWS has EBITDA margins of around 50%.""
Janney's Shawn Milne (upgrade to Buy): ""AWS segment margins of 16.9% in Q1, 14.2% in FY14 — well ahead of general Street thoughts that AWS was in 'investment mode,' and losing 5-10% (or more)."" He does note Amazon's North American retail op. margin fell to 2.5% in 2014 from 2.8% in 2013 (thanks largely to the Fire Phone debacle), but adds it rebounded to 3.9% in Q1.
Raymond James' James Kessler (upgrade to Outperform) focuses on Amazon's total margin improvement. ""Non-GAAP operating margin of 3.1% was ~100 bp above our/consensus estimates driven by improved gross margins and modestly lower than expected operating expenses. Amazon also guided 2Q margins above consensus at the high end.""
On SA, Brian Nichols argues AWS would be worth $50B at 45x forward op. income, and thinks the business could be valued at $85B if publicly traded by itself. The Panoramic View: ""Facebook and other leading tech companies used to garner a 10x revenue valuation when they were in similar stages of development. I think that the same can be applied to AWS.""
On the CC (transcript), Amazon stated active customer accounts rose by 8M Q/Q to 278M (260M paying customers). Y/Y paid unit growth was steady at 20%, and 3rd-party sellers made up 44% of sales vs. 43% in Q4.
Prior Amazon earnings coverage
 ",0.996,positive,0.8167534523809524
637,2015-04-23,0.19,Amazon tops $415; $265M AWS op. profit reported,"

In its first quarter of breaking out Amazon Web Services' performance, Amazon (NASDAQ:AMZN) states the cloud infrastructure giant had Q1 revenue of $1.57B (+49% Y/Y) and (in spite of AWS' aggressive pricing) an op. profit of $265M (+8%).
Driving the Q1 revenue beat: North American revenue (not counting AWS) rose 24% to $13.4B, with segment op. profit totaling $517M - media +5%, electronics/general merchandise +31%. On the other hand, international revenue fell 2% to $7.7B; sales would've risen 14% if not for forex. International media -12%, EGM +4% . The segment had a $76M op. loss.
With the help of AWS and 3rd-party seller growth, gross margin rose to 32.2% from 28.8% a year ago. Fulfillment spend +19% to $2.8B, marketing +24% to $1.1B, tech/content +38% to $2.8B, G&A +31% to $427M.
Free cash flow for the trailing 12 months rose to $3.16B from $1.94B at the end of Q4 and $1.49B a year earlier. Q2 op. profit/loss guidance assumes $600M in stock compensation and amortization costs.

AMZN +6.7% AH to $415.95, taking out its old highs along the way.

Q1 results, PR
 ",0.9856,positive,0.8167534523809524
638,2015-04-23,0.19,"Amazon beats estimates, guides in-line","

Amazon (NASDAQ:AMZN): Q1 EPS of -$0.12 beats by $0.01.
Revenue of $22.72B (+15.1% Y/Y) beats by $330M.
Expects Q2 revenue of $20.6B-$22.8B (+7-18% Y/Y) vs. a $22.1B consensus.
Expects Q2 op. income of -$500M to $50M vs. -$15M in Q2 2014.
Shares +3.2% AH.
 ",0.6058,positive,0.8167534523809524
639,2015-04-14,2.75,"Jefferies hikes Amazon target to $465, sees fulfillment edge","

""[W]e believe Amazon's (AMZN +0.6%) fulfillment strategy is helping the company deliver a superior customer experience (which should drive unit and revenue growth) while extracting optimal value from each customer,"" writes Jefferies' Brian Pitz. His target has been hiked by $65 to $465, and his 2016 EPS estimate to $2.46 from $1.03.
Pitz asserts Amazon's huge fulfillment investments (often criticized over the years) enable ""increasing scale efficiencies and much better control of the customer experience & service levels"" relative to e-commerce rivals, and have allowed it to offer ""the broadest selection of fulfillment options at the lowest prices."" He also notes the spending has helped Amazon expand into local commerce (e.g. AmazonFresh and Prime Now).
Like others, he also sees AWS (an estimated ~6% of current revenue) acting as a growth driver, and believes it has a better margin profile than Amazon overall. Pitz's target is equal to 14x his 2016 EBITDA estimate; he forecasts a 30% EBITDA CAGR from 2015-2018.
The note comes ahead of Amazon's April 23 Q1 report. Shares blasted off in January following a Q4 EPS beat made possible by gross margin gains and slower spending growth. Fulfillment spend rose 17% Y/Y in Q4 vs. 30% in Q3.
 ",0.9906,positive,0.8167534523809524
640,2015-04-14,2.75,"Amazon, HarperCollins reach publishing deal","

Amazon (NASDAQ:AMZN) and HarperCollins (NASDAQ:NWSA) have reached a new multi-year publishing deal - expected to go into effect this week - that covers both print and digital titles.
The agreement calls for HarperCollins to set the retail prices of its digital books, with incentives for HarperCollins to provide lower prices to consumers.
In November, Amazon ended its brutal battle with Hachette over print and e-books, following a six month stand-off that battered the French-owned publisher’s sales.
Previously: HarperCollins next to collide with Amazon on e-books (Apr. 02 2015)
 ",0.4533,positive,0.8167534523809524
641,2015-03-30,4.03,"Amazon launches Home Services site, takes on Angie's List","

Four months after the company started promoting local services to its customers, Amazon (AMZN +0.8%) has launched a Home Services site with the help of partners such as TaskRabbit, Pep Boys, and TakeLesons. Market leader Angie's List (ANGI -4.6%) isn't reacting well to the news.
Amazon exec Peter Faricy: ""We have 85 million Amazon customers who have shopped for products this past year that often require a service afterwards."" 700 services are initially supported; much like Angie's List, Amazon argues it helps connect consumers with trustworthy businesses. Only 3 out of every 100 professionals in each metro are said to be accepted, with Amazon making sure each business is licensed, insured, and passes a background check.
The e-commerce giant also claims it only takes 60 seconds for a customer to buy a service. Faricy: ""We have standardized and prepackaged all of our service offerings. So you know exactly what is going to be done and how much it’s going to cost you, up front, no surprises.""
41 states are currently supported; Amazon wants to provide strong coverage across the 30 biggest U.S. metro areas. The Verge notes a beta version of Amazon's site suggests the company is taking a 20% cut on standard services, 15% on custom services, and 10% on recurring services.
 ",0.9901,positive,0.8167534523809524
642,2015-03-27,3.21,WWD: Amazon in talks to acquire Net-a-Porter,"

Amazon (NASDAQ:AMZN) is in talks to buy online luxury retailer Net-a-Porter in what could be the biggest acquisition yet for the e-commerce giant, Women's Wear Daily reports.
Amazon has long coveted the high-end fashion retail sector and any deal for Net-a-Porter, which is owned by Swiss firm Compagnie Financire Richemont (OTCPK:CFRUY), could come with an approximate €2B price tag.
 ",0.8977,positive,0.8167534523809524
643,2015-03-20,5.25,FAA gives go-ahead for Amazon drone tests,"

The FAA has granted Amazon (NASDAQ:AMZN) approval to test a delivery drone outdoors, allowing test flights over private, rural land in Washington state.
The company also received an exemption from certain flight restrictions, but must keep flights below 400 feet and the drone in sight.
Amazon's ""Prime Air"" program looks like it now has the opportunity to get off the ground, after being jeopardized in February under the FAA's commercial drone rules.
 ",0.8738,positive,0.8167534523809524
644,2015-03-12,7.87,Amazon buys IoT service provider 2lemetry,"

2lemetry's cloud-based platform serves as middleware for large networks of Web-connected embedded devices - the proverbial Internet of Things (IoT). It translates the various protocols used by connected devices, sets messaging rules, and analyzes the data traffic it handles to derive insights.
The startup boasts its solution can work with any protocol or hardware platform, automatically add new devices as they join a network, and scale to millions of devices without hurting performance. Honeywell is among the company's enterprise clients.
Amazon (NASDAQ:AMZN) has bought 2lemetry for an undisclosed sum, and says it will continue supporting the company's clients. 2lemetry's services appear to complement AWS' Kinesis service, which provides real-time processing for massive data streams, including for data produced by IoT devices and sensors.
TechCrunch notes 2lemetry's Incoming service might particularly interest Amazon - it helps companies (such as retailers) interact with customers using data obtained via proximity beacons, geofencing, facial recognition, and other sources.
Though better known for their machine-to-machine (M2M) communications hardware, Sierra Wireless (NASDAQ:SWIR) and CalAmp (NASDAQ:CAMP) are two companies that have been going after the budding IoT service market. Sierra recently bought M2M connectivity/messaging service provider Wireless Maingate, and CalAmp has launched its Connect service platform for deploying and managing M2M devices.
 ",0.9873,positive,0.8167534523809524
645,2015-02-13,4.66,"Whole Foods postpones annual meeting, citing SEC","
 Whole Foods (WFM) says it's decided to postpone its 2015 annual meeting, previously scheduled for March 10. In today's 8-K the company says the postponement is due to the SEC retracting a Dec. 1 statement about exclusion of a particular shareholder proposal. Whole Foods hasn't set a new meeting date yet but will ""after a final decision has been made"" and will file and mail proxies then.  ",0.7252,positive,0.8167534523809524
646,2015-02-13,4.66,Whole Foods Market considers opening health care retreats,"
 Whole Foods Market (WFM) eyes the health clinic space with two different idea percolating in the C-suite. The company plans to test a getaway health retreat in Austin if it lands space and will discuss opening an employee medical clinic. Currently, Whole Foods has a week-long health program for employees which includes nutrition and cooking assistance along with a health assessment.  ",0.7615,positive,0.8167534523809524
647,2015-02-13,4.66,Whole Foods Market talks store growth,"
 Whole Foods Market (WFM) plans to open 38 to 42 new stores this year. The planned growth represents a 9%-10% increase in square footage. The company currently has a store count of 408. The long-term target is for 1.2K stores with a focus on the larger format. ""We think there is a lot of opportunity with the bigger stores,"" said EVP Jim Sud. Whole Foods earnings call transcript  ",0.9043,positive,0.8167534523809524
648,2015-02-12,2.03,52-week high for Whole Foods Market post-earnings,"

Morgan Stanley thinks Whole Foods Market (WFM +5%) is seeing a lift from initiatives (online, loyalty, store refreshes) launched by the company.
The 100 bp jump in traffic and comp growth acceleration in Q4 both point to growing momentum for the grocery store chain, reasons MS.
Previously: Whole Foods Market beats by $0.01,  revenue in-line (Feb. 11)
Previously: Whole Foods Market delivers 4.5% comp in FQ1 (Feb. 11)
Shares of WFM printed a 52-week high of $56.77 in trading this morning.
 ",0.9342,positive,0.8167534523809524
649,2015-02-11,2.145,"Reuters: Amazon Prime has 96% satisfaction, but delays growing","

A Reuters/Ipsos survey of Amazon (NASDAQ:AMZN) Prime users found 96% stating they're happy with the 2-day shipping/streaming service. The figure comes about a year after Amazon hiked Prime's annual fee by $20 to $99.
At the same time, 10% of 1,700 polled respondents who chose Amazon's 2-day shipping said items ordered between Nov. 1 and Dec. 31 didn't arrive on the expected day. For its part, Amazon says its internal data ""shows significantly better results.""
Amazon mentioned in its Q4 report Prime subscribers rose 53% in 2014 (50% in the U.S.) in spite of the price hike. With the company declining to provide a total subscriber figure, RBC estimated in September Amazon has 30M-40M Prime subs in the U.S., and 40M-50M globally.
Amazon has added to its roster of local/regional shipping partners as it tries to keep up with order growth. The company's Q4 EPS beat was partly the result of a major slowdown in fulfillment spending growth (+17% Y/Y in Q4 vs. +30% in Q3).
 ",0.9751,positive,0.8167534523809524
650,2015-02-11,2.145,Whole Foods Market delivers 4.5% comp in FQ1,"
 Whole Foods Market (WFM) reports comparable-store sales increased 4.5% in FQ1 vs. 5.4% a year ago and 3.1% last quarter. Average weekly sales per store came in at $724K. Transactions were 2.3% higher during the period, while the average basket was up 2.2%. The EBITDA margin was 8.5%, down 60 bps Q/Q. Gross margin rate -20 bps to 34.8% on higher input costs. SG&A expense rate -4 bps to 28.5%. Guidance: The company reiterates FY15 guidance of +9% sales growth and EBITDA margin of around 9%. FQ2 comps are up 4.9% through February 8. WFM +3.25% AH.  ",0.7823,positive,0.8167534523809524
651,2015-02-11,2.145,"Whole Foods Market beats by $0.01,  revenue in-line","

Whole Foods Market (WFM): FQ1 EPS of $0.46 beats by $0.01.
Revenue of $4.67B (+10.1% Y/Y) in-line.
 ",0.0155,positive,0.8167534523809524
652,2015-01-30,42.75,Amazon soars to $359 as Street bets on improving profits,"

Amazon's (AMZN +14.8%) Q4 North American op. margin of 5.4% was its highest in three years, notes SunTrust's Robert Peck, reiterating a Buy and upping his target to $370. Peck is also pleased gross margin rose Q/Q in spite of seasonality, even if one backs out Other (i.e. AWS) revenue. Third-party seller and fulfillment service growth drove the gains, as did improved efficiency.
Topeka's Victor Anthony likes the fact Prime memberships rose 53% in 2014 (no precise subscriber number has been given, as usual) in spite of Amazon's $20 price hike. Benchmark's Daniel Kurnos observes the bulk of Amazon's Q4 revenue miss was due to its international ops, where the company took an $895M forex hit.
B. Riley's Scott Tilghman (Neutral) is more cautious. ""We aren’t convinced the company has the same leverage opportunity in non-holiday quarters, and this seems to be captured in its 1Q guidance, which assumes bigger FX headwinds and lower Y/Y profit."" On SA, Paulo Santos is as bearish as ever, citing (among other things) the top-line miss and a 4% drop in Media revenue.
During the CC (transcript), CFO Tom Szkutak stated Amazon would begin breaking out AWS revenue for the first time in Q1. He also mentioned (giving encouragement to bulls) Amazon is ""putting even more energy and attention on driving what we would call fixed expense and variable expense productivity as well as other efficiency projects.""
Also disclosed: Third-party seller units made up 43% of Q4 unit sales, up from Q3's 42%. Annual paid unit growth slipped to 20% from Q3's 21%.
Prior Amazon earnings coverage
 ",0.9918,positive,0.8167534523809524
653,2015-01-29,7.87,"Amazon +8%; EPS beat, margin gains overshadow revenue softness","

Amazon (NASDAQ:AMZN) expects Q1 revenue of $20.9B-$22.9B (+6%-16% Y/Y), below a $23.05B consensus. Op. income guidance is at -$450M to $50M, and includes $450M in stock compensation and amortization costs.
Revenue growth fell to 15% in Q4 from 20% in Q3, with North American sales (64% of total) rising 22% and international only 3%. International would've been up 12% if not for forex.
Media revenue fell 4% Y/Y in Q4 to $6.95B (international -8%, North America +1%). But electronics/general merchandise rose 21% to $20.6B (international +10%, North America +27%).
Other revenue (dominated by AWS) rose 26% Q/Q and 41% Y/Y to $1.74B. AWS usage was up nearly 90% Y/Y, and active customers now top 1M.
Contributing to the EPS beat: Gross margin rose to 29.5% from 26.5% a year ago. Also helping: While fulfillment spend rose 17% Y/Y to $3.4B, that's a much slower pace than Q3's 30%. Marketing spend +35% to $1.5B; tech/content +42% to $2.6B; G&A +39% to $442M. Op. margin was 2%, even with a year ago.
Third-party sellers using Amazon's fulfillment services rose over 65% Y/Y in 2014 (share gains against eBay), and accounted for over 40% of Q4 third-party units.
Shares have risen above $336 AH.

Q4 results, PR

Update (6:32PM): Amazon is now up 14.2% AH.
 ",0.9945,positive,0.8167534523809524
654,2015-01-29,7.87,"Amazon beats by $0.28, misses on revenue","

Amazon (NASDAQ:AMZN): Q4 EPS of $0.45 beats by $0.28.
Revenue of $29.33B (+15% Y/Y) misses by $340M.
Shares +5.39%.
 ",0.2658,positive,0.8167534523809524
655,2015-01-23,2.07,Weekend price cut on Amazon Prime,"
 Amazon (NASDAQ:AMZN) plans to reduce the price on Amazon Prime to $72 for a 27-hour period this weekend. The price drop is part of a promotion tied to original TV series Transparent. All 10 episodes of the Golden Globe-winning series will available for streaming on Saturday outside of the Prime service.  ",0.7728,positive,0.8167534523809524
656,2015-01-22,13.07,Amazon buys secretive chipmaker for reported $350M,"

Amazon (AMZN +4.3%) has acquired Annapurna Labs, an Israeli chipmaker that has provided few details about the silicon it's working on. The NYT reports the purchase price is $350M. The WSJ previously reported of a $350M deal price, while adding the final tab could be $375M if certain conditions are met.
According to the WSJ's sources, Annapurna is developing ""midrange networking chips for data centers, offering improvements over existing products in terms of information-transmission rates and power consumption."" Israel's Calcalist reports the company is developing ""microprocessors that allow fast data traffic for low-power computing servers and storage servers.""  It also notes CPU core giant ARM (NASDAQ:ARMH) is an investor.
AWS' data centers contain hundreds of thousands of servers running Intel (NASDAQ:INTC) x86 CPUs. Though Amazon has downplayed the efforts of 3rd-party ARM server CPU vendors, it has also hired several key engineers from defunct ARM CPU vendor Calxeda, a move that has fueled speculation Amazon is prepping its own ARM server chips. Annapurna could assist with the effort.
The news comes on a day in which Piper has assigned AWS a ~$32B valuation.

Earlier: Amazon rallies following eBay's earnings
 ",0.9834,positive,0.8167534523809524
