,Date,changed,title,details,news_score,news_result,average
0,2018-12-28,16.38,"Yankees in talks with Amazon, Sinclair for Yes Network","
The New York Yankees are in talks with Amazon (NASDAQ:AMZN) and Sinclair Broadcast Group (NASDAQ:SBGI) about a joint bid for the team's regional sports network, Yes, WSJ reports.The baseball team, which owns 20% of Yes, has also been talking to other potential partners including cable and satellite TV provider Altice USA (NYSE:ATUS) and RedBird Capital about buying the remaining 80% stake from Walt Disney (NYSE:DIS).Disney is seeking a valuation of $5B-$6B for Yes Network. ",0.9786,positive,0.8167534523809524
1,2018-12-26,126.94,"India's new rules could hit Amazon, Walmart","
India will ban e-commerce companies from selling products in which they have an equity interest, which could impact Amazon (AMZN +5.9%) and Walmart's (WMT +3.3%) Flipkart.The companies also can't form exclusive agreements with sellers. But they can make bulk purchases through their wholesalers or retail groups and then sell those products to sellers with agreements.The rules, which are meant to appease local retailers, go into effect on February 1. ",0.4177,positive,0.8167534523809524
2,2018-12-26,126.94,Report: Amazon advised U.S. government on portal,"
Amazon (NASDAQ:AMZN) exec Anne Rung privately advised a top U.S. Government Services Authority official Marie Davie on a procurement portal that could be worth billions, reports The Guardian with emails obtained from a Freedom of Information Act request.Rung formerly served in the Obama administration and was credited with transforming federal procurement policies before leaving for Amazon.The talks happened before the legislation that created the portal was signed into law in late 2017.The National Defense Authorization Act moves Defense Department of commercial products to online marketplaces, and the program must ""enable government-wide use of such marketplaces,"" which implies the need for a large-scale platform like Amazon.The emails don't show any illegal activity but put into focus Amazon's close ties to the government, which is a key point in competitor objections to the pending $10B winner-takes-all Pentagon cloud contract. ",0.8249,positive,0.8167534523809524
3,2018-12-26,126.94,Amazon: 'This season was our best yet',"
""Amazon customers made this holiday season record-breaking with more items ordered worldwide than ever before,"" according to a company press release.Consumers purchased millions more Amazon Devices, and tens of millions of people worldwide started Prime free trials or began paid memberships.More than 50% of items sold in Amazon's (NASDAQ:AMZN) stores this holiday season also came from small and medium-sized businesses. ",0.9573,positive,0.8167534523809524
4,2018-12-18,30.57,CNBC: Amazon exec leaves after two-year hiatus,"
Amazon (AMZN +1.1%) senior exec Diego Piacentini leaves the company after taking a two-year hiatus to work with the Italian government, according to CNBC sources.The government project ended in October and Piacentini opted not to return to Amazon, where he had led the international business and served on the ""S-Team"" of insiders close to Jeff Bezos.Piacentini was Amazon's third largest employee shareholder at the time of his hiatus. ",0.4211,positive,0.8167534523809524
5,2018-12-18,30.57,Stocks gain strongly after blue Monday,"
U.S. stock markets start strongly, led by industrial goods (+1.6%), tech (+1.1%), and financial (+1.0%).S&P 500 1.1%, Nasdaq +1.1%, Dow +1.4%.Individual names gaining include Amazon (AMZN +1.8%), Alphabet (GOOG +1.6%), Boeing (BA +4.8%), Bank of America (BAC +2.4%).J&J (JNJ +1%) rebounds as it announces a $5B stock buyback; follows a sharp two-day decline on a Reuters story alleging asbestos was found in the company's baby powder.Oracle (ORCL +3.8%) gains after providing better-than-expected Q3 guidance.Crude falls 3.1% to $48.36; prices drop to a 14-month low.U.S. dollar index falls 0.2% to 96.98.U.S. 10-year Treasury bid up, pushing yield down almost 1 basis point to 2.85%; 2-year Treasury yield also down almost 1 basis point at 2.687%. ",0.8753,positive,0.8167534523809524
6,2018-12-12,20.3,N.J. labor coalition wants code of conduct for Amazon (update),"
A coalition of labor groups wants New Jersey to enforce a ""code of conduct"" for Amazon (NASDAQ:AMZN) warehouse workers that includes minimum wage, stable hours, and union rights.Warehouse Workers Stand Up release a report detailing the dangerous and unstable work conditions at warehouses for Amazon and other major companies including Costco and Macy's. The report says over 40K New Jersey residents work at warehouse distribution centers.The group wants the state to require companies to sign the code before receiving any potential tax breaks and subsidies such as those Amazon will receive for its NYC portion of HQ2.Read the full report here.Previously: Amazon workers in NYC want to unionize (Dec. 12)Update with Amazon's statement to Seeking Alpha: ""Amazon already provides each of the items suggested, including our $15 hourly minimum wage across the US, which in NJ ranges from $15 - $18.15. We also offer industry leading benefits, including comprehensive healthcare from day one, pre- paid education through Career Choice, and up to 20 weeks parental leave. We are proud of our focus on safety, employee engagement, open door communication culture and industry leading benefits. We encourage anyone to compare our compensation, benefits, and workplace to other retailers, and to come take a tour and see for yourself through our public fulfillment center tours.” ",0.9923,positive,0.8167534523809524
7,2018-12-12,20.3,Amazon workers in NYC want to unionize (update),"
Workers at Amazon's (AMZN +2.6%) new Staten Island fulfillment center announce plans to unionize through a partnership with the Retail, Wholesale and Department Store Union.The employees want to address a variety of issues including safety, insufficient breaks, and unreasonable quotas.An Amazon training video recently leaked that encourages fulfillment managers to look for signs of union organizing activities and to express strong personal disagreement with unions to those workers.Amazon recently selected Queens, New York as one of its HQ2 locations. The tech giant will invest $2.5B in the campus over 15 years and receive over $2B in tax breaks.Update with Amazon's statement to Seeking Alpha: “Amazon associates are the heart and soul of our operations, and we respect employees’ right to choose to join or not join a labor union. Amazon maintains an open-door policy that encourages employees to bring their comments, questions, and concerns directly to their management team for discussion and resolution. We firmly believe this direct connection is the most effective way to understand and respond to the needs of our workforce.” ",0.9872,positive,0.8167534523809524
8,2018-12-12,20.3,Amazon partners with Orange; launches Nordics region,"
French telecom Orange partners with Amazon (NASDAQ:AMZN) to combine voice assistants.The partnership means users can request Amazon products and services through Orange's Djingo assistant.Orange wants to ""go further"" and is working with Amazon to integrate Orange's AI, Djingo, and Alexa into ""our respective devices.""Amazon has a similar integration agreement with French telecom Iliad, which has Alexa in its new set-top box.In other Amazon global news, AWS officially opens its first cloud region in the Nordics after first revealing the plan last April.The AWS Europe (Stockholm) Region brings AWS to a total of 60 Availability Zones across 20 global infrastructure regions. ",0.9501,positive,0.8167534523809524
9,2018-12-12,20.3,Bigger footprint with smaller Amazon Go,"
Amazon (NASDAQ:AMZN) is taking its cashier-free shops in a new, smaller direction.Located in one of the company’s Seattle offices, the eighth Amazon Go store is about a quarter of the size of its predecessors, at a mere 450 square feet.Such small stores could help Amazon broaden its bricks-and-mortar footprint and keep ahead of startups which are trying to convince existing retailers to buy their cashierless technology. ",0.8778,positive,0.8167534523809524
10,2018-12-11,2.21,Report: Japan to increase scrutiny of foreign big-data firms,"
 Japan's government is going to set up an oversight panel to keep a closer eye on foreign ""big data"" companies that deal with concentrated information from consumers and small businesses, Nikkei reports. That affects the usual tech suspects: Facebook (NASDAQ:FB), Amazon.com (NASDAQ:AMZN), Netflix (NASDAQ:NFLX), Google (GOOG, GOOGL), and even Alibaba (NYSE:BABA), among others. The panel is expected to be established as soon as 2020, according to a draft report, and a framework should be in place by next summer. Meanwhile, Japan's Fair Trade Commission will survey the IT industry as early as January with an eye to finding illegal business practices or contracts.  ",0.9562,positive,0.8167534523809524
11,2018-12-11,2.21,Cowen analyst calls Amazon top pick for 2019,"
Cowen analyst John Blackledge calls Amazon (AMZN +0.8%) his best idea for 2019.The analyst forecasts 17% annual revenue growth for the next five years from drivers that include B2B and emerging markets.Blackledge says AWS ""should enjoy years of secular tailwinds driving revenue CAGR of 31 percent from 2019 to 2024 as workloads migrate to the cloud.""Blackledge's Amazon target is at $2,250, a 37% upside. ",0.9496,positive,0.8167534523809524
12,2018-12-11,2.21,Amazon plans chips in Intel's territory,"
The New York Times reports on Amazon's (AMZN +1.3%) plans to create in-house data center chips, putting the e-commerce giant into Intel's (INTC +2.5%) wheelhouse.Amazon won't sell the chips to consumers and won't produce all of the chips it needs. But the move can increase Amazon's bargaining power with Intel, which has dominated the server chip market for years.About 35% of server chips in the world go to 10 companies, according to IDC data. And Intel holds about 97% of that market.Amazon isn't the first company to go it (mostly) alone on chips, and the company already has the AI-focused Inferentia chip. Google has designed in-house AI chips. Facebook and Microsoft are working on similar chips. Apple built its first custom iPhone chip four years ago. ",0.9191,positive,0.8167534523809524
13,2018-12-11,2.21,Report: Disney looks to sell regional sports nets piecemeal,"
 Disney (DIS +1.2%) is increasingly likely to sell off the 22 regional sports networks it's getting from Fox (FOX +0.4%, FOXA +0.2%) in pieces rather than to a single buyer, the New York Post reports. That's due to the complications arising in the sale, according to the report. A single deal would be simpler, but Disney is seeking a solid overall price on a package of deals it must complete within 90 days of closing the $71.3B Fox asset transaction. The only known serious party to make a single bid for all the RSNs is Sinclair Broadcast Group (SBGI +2.6%)/CVC Capital, but the Post says that was a lowball bid. Meanwhile, Apollo (APO +3%) and Nexstar (NXST +4.7%) have bid for almost all the networks -- but Apollo needs a partner, and Nexstar is likely less serious after agreeing to pay $6B for Tribune Media (NYSE:TRCO). Still out there for some slice of the RSNs: Charter (CHTR +0.9%), Minnesota Twins owner Jim Pohlad, Major League Baseball, the New York Yankees (for YES Network), Amazon.com (AMZN +0.4%), Blackstone (BX +2.9%), and Tegna (TGNA +3.2%), among others.  ",0.9797,positive,0.8167534523809524
14,2018-12-11,2.21,Invesco QQQ ETF (QQQ) November Summary,"
November monthly performance was: -1.96%AUM of $66B52-week performance vs. the S&P 500 is: +5%$0.33 in dividends were paid in NovemberTop 10 Holdings as of 11/29/2018: Apple Inc (AAPL): 10.91098%, Microsoft Corp (MSFT): 10.63103%, Amazon.com Inc (AMZN): 10.26999%, Alphabet Inc Class C (GOOG): 4.79084%, Facebook Inc A (FB): 4.20797%, Alphabet Inc A (GOOGL): 4.11657%, Cisco Systems Inc (CSCO): 2.80112%, Intel Corp (INTC): 2.76728%, Comcast Corp Class A (CMCSA): 2.26782%, PepsiCo Inc (PEP): 2.10457% ",0.6276,positive,0.8167534523809524
15,2018-12-10,11.9,"Mattel, Hasbro drop on Amazon's private label toys","
Amazon (AMZN -1.2%) is launching its first private label line of toys for toddlers and kids. TJI Research spotted the AmazonBasics product pages for some products, though shipping isn't yet available.Mattel (NASDAQ:MAT) shares are down 4.5% while Hasbro (NASDAQ:HAS) drops 2.4%. ",0.6681,positive,0.8167534523809524
16,2018-12-10,11.9,Amazon Go flagship for London?,"
Amazon (NASDAQ:AMZN) reportedly plans to open a flagship Amazon Go store in London's West End, according to The Telegraph.Sources say Amazon is looking for a space with 3K to 5K square feet to house the cashier-less store.Amazon tells the Telegraph that it doesn't comment on rumors, which isn't a denial.Previously: Amazon Go getting ready for takeoff (Dec. 7) ",0.8525,positive,0.8167534523809524
17,2018-11-30,16.6,Apple Music coming to Amazon Echos,"

Apple (NASDAQ:AAPL) Music is coming to Amazon (NASDAQ:AMZN) Echo speakers beginning the week of December 17. Amazon made the announcement in a blog post.
The service will be added as a skill that users will have to enable before linking their Music account.
Echo speakers compete with Apple's HomePod smart speaker.
 ",0.8105,positive,0.8167534523809524
18,2018-11-28,96.33,Amazon launches Security Hub,"

Amazon (AMZN +6.2%) announces the new AWS Security Hub service lets users streamline high-profile security alerts and compliance status across AWS accounts.
Security Hub can draw information from Amazon GuardDuty, Amazon Inspector, and Amazon Macie, as well as from AWS Partner solutions

Check Point (CHKP +3%) and Tenable (TENB +3%) have announced integrations with the AWS Security Hub.
Related cybersecurity ETFs: HACK, CIBR
 ",0.9634,positive,0.8167534523809524
19,2018-11-28,96.33,AWS announces its A.I. chip,"
 Amazon (AMZN +4.9%) Web Services announces its entry into A.I. chips with Inferentia, which will become available next year. AWS says Inferentia is designed to offer ""high throughput, low latency inference performance at an extremely low cost"" and will support TensorFlow, Apache MXNet, and PyTorch deep learning frameworks plus models using the ONNX format. The chip will be available for use with Amazon SageMaker, Amazon EC2, and Amazon Elastic Inference. Cloud competitor Google released its Tensor Processing Unit accelerator in 2016 and this past July launched the Edge TPU AI chips. Alibaba also has plans to enter the market.  ",0.9029,positive,0.8167534523809524
20,2018-11-28,96.33,Amazon moving off Oracle databases,"

Amazon (AMZN +1.7%) Web Services CEO Andy Jassy says Amazon will be off Oracle (ORCL) databases by the end of 2019.
This month, Amazon moved its data warehouse from Oracle to its own Redshift service.
Jassy says 88% of Amazon databases running on Oracle will transfer to Amazon DynamoDB or Amazon Aurora by January and 97% will be moved by the end of the year.
 ",0.9097,positive,0.8167534523809524
21,2018-11-28,96.33,Jefferies: AWS headed for $71B in revenue,"

Amazon (NASDAQ:AMZN) Web Services revenue could reach $71B by 2022, according to Jefferies analyst Brent Thill after attending this year's re:Invent conference.
The revenue total would give AWS a valuation of about $350B.
Thill says customers are ""jumping in big with AWS"" and increasing partner deal sizes by 3.5x last year. Commitments include Korean Air (an Oracle (ORCL +0.1%) customer) committing to a 10-year deal to move all systems to AWS and Amgen moving over most of its cloud infrastructure.
Amazon shares are up 2.5% to $1,621.33. 

 ",0.952,positive,0.8167534523809524
22,2018-11-27,0.09,WeWork pilot of Amazon Alexa for Business comes to halt,"
 A pilot program for Amazon.com's (NASDAQ:AMZN) business-case voice assistant, Alexa for Business, has been paused at WeWork (VWORK), CNBC says, though it's grown quite popular at Amazon itself. WeWork was promoted as a flagship customer of the new offering back in March. But the pilot lasted for about two months, according to the report. The service lets workers perform such tasks as reserve conference rooms or adjust temperatures by talking to Alexa-powered devices. And while WeWork isn't using it anymore, Amazon notes that more than half of its meetings start by talking to the Alexa assistant rather than typing in information. That leads to meetings that start in an average of less than nine seconds, Amazon data show.  ",0.9807,positive,0.8167534523809524
23,2018-11-27,0.09,Amazon selling patient data software,"

Amazon (NASDAQ:AMZN) is selling software to mine patient health records for information that could help doctors improve treatments and lower costs, according to the WSJ.

The software can read digitized medical records and clinical notes then pick out key data points.
AWS has sold similar text-analysis software to companies outside of the healthcare industry.
 ",0.9563,positive,0.8167534523809524
24,2018-11-27,0.09,AWS launches cloud service for satellite data,"

Amazon (AMZN) announces AWS Ground Station, a cloud service for data from satellites.
Customers can downlink current data from 12 AWS ground stations around the world and quickly use AWS services to process, store, and analyze the data.
Initial customers include Spire, BlackSky, and DigitalGlobe.
 ",0.5699,positive,0.8167534523809524
25,2018-11-27,0.09,THR: YouTube pulling back from scripted content spending,"
 YouTube (GOOG -0.6%, GOOGL -0.6%) is pulling back from scripted content output, a reversal of a strategy that pushed a premium subscription tier, The Hollywood Reporter says. The video platform will cut back starting in 2020, and executive will double down on the ad-supported video by making all its originals free to all users, not just those paying $12/month for YouTube Premium. That means a ""serious budget reduction,"" if not a total pullback from what has been hot competition among distributors for bigger-budget content. The platform might release a show week-to-week for free while giving Premium subscriber the option to binge. YouTube's originals budget (said to be hundreds of millions of dollars a year) is still overshadowed by the billions annually at Netflix (NFLX +1.7%) and Amazon.com (AMZN -0.1%). Also a player here: Hulu, co-owned by Comcast (CMCSA +1.6%), Disney (DIS +1.3%), Fox (FOX +0.6%, FOXA +0.5%) and WarnerMedia (T +1.5%).  ",0.9344,positive,0.8167534523809524
26,2018-11-27,0.09,AWS using more efficient ARM server chips,"

Amazon (AMZN +0.4%) Web Services begins using more efficient ARM-based server chips with the AWS Graviton Processors announced at the re:Invent conference.
Amazon says the processors are optimized for scale-out workloads that can spread across multiple smaller instances.
The first set of instances (A1) is now available in select regions in the U.S. and Europe.
AWS is moving to its Nitro System, which provides a framework for building instance types faster.
Earlier this month, AWS announced support for AMD's (AMD +6.2%) EPYC processors.
Previously: AMD +5.6% on Next Horizon event, AWS instances announcement (Nov. 6)
 ",0.945,positive,0.8167534523809524
27,2018-11-27,0.09,Amazon: Cyber Monday breaks records,"
 Amazon (NASDAQ:AMZN) says Cyber Monday was once again       the single biggest shopping day in the company’s history based on a count of products ordered. In addition, the five-day shopping period inclusive of Black Friday and Cyber Monday broke records (+180M items). 
Notable Amazon Black Friday/Cyber Monday pullouts: Customers ordered more than       18M toys globally [heads-up Hasbro (NASDAQ:HAS) and Mattel (NASDAQ:MAT)] and more than 13M fashion items; Sales by small and medium-sized businesses worldwide grew more than 20% Y/Y on Black Friday; Best-selling products at Amazon 4-star and Amazon Books included the all-new Echo Dot, Becoming by         Michelle Obama, the Amazon Smart Plug and the L.O.L. Surprise Series         toys; Best-selling products across Amazon.com on Cyber Monday included         the all-new Echo Dot, AncestryDNA: Genetic Testing Ethnicity, Bose         QuietComfort 25 Acoustic Noise Cancelling Headphones for Apple         devices, Becoming by Michelle Obama, Jenga and Instant Pot         DUO60 – 6 Quart. AMZN  -0.53% premarket to  $1572.90. Source: Press Release
  ",0.9815,positive,0.8167534523809524
28,2018-11-27,0.09,Amazon pushes hard in online ads,"
 Amazon (NASDAQ:AMZN) is rapidly throwing its weight around in the online advertising business, reports The Wall Street Journal's Lara O’Reilly and Laura Stevens. The e-commerce giant already sits positioned behind Google and Facebook as number three in the U.S. digital ad market and is expected to see ad revenue soar to $28.4B over the next five years from $5.83B this year. ""I think the giant has been awoken,"" sums up Mediocean CEO Bill Wise on the rise of Amazon advertising. Best of all for Amazon investors, the ad business is organically a high-margin driver of profits. Amazon's major competitors in the online ad space are Tencent (OTCPK:TCEHY), Alibaba (NYSE:BABA) and Baidu (NASDAQ:BIDU) - along with the dominant players Facebook (NASDAQ:FB) and Google (GOOG, GOOGL). AMZN -0.86% premarket to $1,576.77.  ",0.9709,positive,0.8167534523809524
29,2018-11-26,79.27,Cyber Monday expected to set a record,"
 Cyber Monday is expected to generate $7.8B in sales, according to the latest tabulation from Adobe Analytics. That tally would mark a gain of 18% over last year's Cyber Monday sales haul and would make today the biggest online shopping day in U.S. history. Adding to the e-commerce good cheer, online sales were up 24% on Black Friday to $2.6B. The strong Black Friday to Cyber Monday performance in retail doesn't take into account the rush of early promotions this fall, led by e-commerce giant Amazon (AMZN +4.5%). Later this week, Cyber Monday updates could be released by some online retailers - including eBay (EBAY +1.5%), Wayfair (W +2.7%) and Etsy (ETSY +5.6%). Investors may also hear channel check updates from analysts on retailers such as Nordstrom (JWN +1.8%), Kohl's (KSS +2.6%), Best Buy (BBY +2.4%), Macy's (M +1.6%), TJX Companies (TJX +0.7%), Gap (GPS +1.4%), American Eagle Outfitters (AEO +5.5%), Foot Locker (FL +4.6%) and L Brands (LB +6.8%). The huge rush of online orders adds a bit of operational pressure on FedEx (FDX +0.4%) and UPS (UPS +1.4%) over the next week or two, but is still seen as a positive development. The Amplify Online Retail ETF (NASDAQ:IBUY) is up 1.44% on the day, roughly in-line with broad market averages. ETFs: XLY, XRT, VCR, RTH, RETL, FDIS, FXD, EMTY, RCD, PMR, FTXD, JHMC  ",0.9768,positive,0.8167534523809524
30,2018-11-26,79.27,Goldman's fortuitous coincidence in Queens deal,"

On the same day that Amazon.com (NASDAQ:AMZN) announced that Long Island City, NY, would be half of its HQ2, Goldman Sachs (GS +2.7%) inked a deal to provide $83M for a major new apartment complex less than a mile away in Hunter's Point South, Bloomberg reports.
The timing was an ""absolute coincidence,"" says Margaret Anadu, the head of Goldman Sachs's Urban Investment Group, the unit that executed the deal.
The project, being built by the Gotham Organization, will have more than 1,000 units, with about 80% designated for affordable housing.
For Goldman, advantages include tax breaks intended to attract investment into low-income areas labeled ""opportunity zones."" Investors that build in these zones can defer taxes on past capital gains and avoid them on future profits from their projects.
Much of Long Island City is located in such a zone.
Also Amazon's move closeby reduces some of the risk in investing in the area and helps to mitigate the possibility that the overall economy will sag by the time the complex gets built.
Previously: Citi makes room for Amazon at Long Island City building (Nov. 13)
Previously: NYC gives Amazon $1.5B incentive for split HQ2 (Nov. 13)
 ",0.9819,positive,0.8167534523809524
31,2018-11-26,79.27,Ellie Mae moves infrastructure to Amazon Web Services,"

Ellie Mae (ELLI +2.1%) is moving its infrastructure to Amazon (AMZN +3.9%) Web Services to rebuild core applications and create new digital products for homebuyers.
Ellie Mae will use AWS, including compute, storage, databse, serverless, and containers to develop new ways to deliver digital mortgages and simplify the loan process.
Previously: Ellie Mae sinks 13% in AH action on disappointing Q4 guidance (Oct. 25)
Previously: First Data to process lending-related transactions for Ellie Mae customers (Aug. 21)
 ",0.7159,positive,0.8167534523809524
