,Date,changed,title,details,news_score,news_result,average
406,2014-12-24,0.16,Facebook signs video clips deal with NFL,"
 Facebook (NASDAQ:FB) signs a deal with the NFL for the rights to video clips. The league has been tight with access to game highlights in the past, even precluding some broadcast partners from streaming game video clips to mobile devices. The video highlights on Facebook will be followed by advertisements from Verizon (NYSE:VZ). The initiative starts next week just in time for the start of the NFL playoff season. What to watch: The high-profile deal could send a chill through the C-suites of broadcasters due to the NFL's strong ties to Madison Avenue ad agencies.  ",0.9258,positive,0.777874358974359
407,2014-12-22,1.57,Facebook takes out October highs,"

Facebook (FB +2.4%) has surpassed its Oct. 28 all-time high of $81.16, made shortly before the company sold off in response to the conservative Q4 guidance and aggressive 2015 spending forecast provided with its Q3 beat.
Shares are up 49% YTD vs. a 14% gain for the Nasdaq. They now go for 43x 2015E EPS and 13x 2015E sales.

Last Friday: Citi values Instagram at $35B
 ",0.9502,positive,0.777874358974359
408,2014-12-19,1.48,Citi values Instagram at $35B,"
Bought for ~$1B by Facebook (FB +1.8%) in 2012, Citi thinks Instagram is now worth 35x as much, and even calls this estimate ""conservative.""Citi: ""While Instagram is still early in monetizing its audience and data assets, and its financial contribution to [Facebook] is minimal today, we believe that it is quickly gaining monetization traction, and would contribute more than $2bn in high-margin revenue at current user and engagement levels if fully monetized.""For reference, Twitter is worth a relatively modest $23.7B. In Twitter's favor: The company is much further along in monetizing its platform, and arguably has more valuable datasets to leverage. In Instagram's favor: Its MAUs just passed Twitter's (the gap will likely widen going forward), and its photo/video streams lend themselves well to brand advertising.Facebook is once more trading near $80. Its all-time high is $81.16. ",0.9813,positive,0.777874358974359
409,2014-12-11,1.55,"Facebook's Oculus buys two startups; Zuck open to ""dislike"" button","

Oculus VR (NASDAQ:FB) has bought Nimble VR, a startup said to be developing ""machine learning and computer vision capabilities to enable high-quality, low-latency skeletal hand tracking.""
It has also bought 13th Lab, a startup working on creating ""an efficient and accurate"" way to acquire/reconstruct 3D models in real-time. Oculus: ""The ability to acquire accurate 3D models of the real-world can enable all sorts of new applications and experiences, like visiting a one-to-one 3D model of the pyramids in Egypt or the Roman Colosseum in VR.""
Also: Oculus has hired NYU prof./motion capture expert Chris Bregler. Bregler, who has done work for Disney, H-P, and LucasFilm, will be directing a ""vision research team"" at Oculus.
The moves drive home Oculus' long-term goal of seeing its VR platform used for applications that go well beyond gaming. They follow Samsung's recent launch of the Oculus-powered Gear VR, The Gear VR, which sells for $199-$249 and relies on a Galaxy Note 4 to provide its display and camera, is aimed at developers and early adopters rather than mainstream consumers.
Meanwhile, Mark Zuckerberg states during a Q&A session Facebook has been thinking about adding a ""dislike"" button, albeit while cautioning he doesn't want it to act as a way to shame users. Zuck suggests the button could act as a way to express sympathy over a sad event.
 ",0.9878,positive,0.777874358974359
410,2014-11-26,1.99,"Facebook, Twitter, other Internet stocks rally","
 Facebook (FB +2.1%) and Twitter (TWTR +2.6%) are rallying on a sleepy pre-Thanksgiving trading day. The companies have respectively seen 21.9M and 16.1M shares traded thus far vs. 3-month averages of 38.3M and 28.1M. Several other Internet stocks (both U.S. and Chinese) are also moving higher. Z +2.3%. TRLA +3%. BITA +5.1%. EJ +6.7%. SFUN +2.6%. VIPS +3.3%. SOHU +2.9%. Facebook is at its highest levels since selling off in late October due to its Q4 revenue and 2015 spending guidance.  ",0.8195,positive,0.777874358974359
411,2014-11-25,1.62,What did the billionaires do in Q3?,"

""Not surprisingly, billionaires reduced their energy allocations (NYSEARCA:XLE) during Q3,"" says Direxion, unveiling the quarterly rebalance for the iBillionaire Index (which serves as the benchmark for the IBLN ETF). Attention was instead shifted to healthcare (NYSEARCA:XLV) and materials (NYSEARCA:XLB), with companies like Humana (NYSE:HUM) and Monsanto (NYSE:MON).
Also added to the index: TMO, GM, FB, CBS, GOOG, MAS, APD, DAL, NOV, WHR, THC, ABBV.
Dropped from the index: AIG, MCK, CTSH, MSI, RIG, CI, APC, GPS, MSFT, CMCSA, NFLX, MHFI, WMB, ICE.
Outlying sectors: Consumer Discretionary (NYSEARCA:XLY) makes up 23.33% of the iBillionaire Index vs. 11.68% for the S&P 500, and Industrials (NYSEARCA:XLI) and financials (NYSEARCA:XLF) make up just 6.67% each of the index vs. 10.44 and 16.30 of the S&P 500, respectively. Consumer Staples (NYSEARCA:XLP) have zero representation in the index vs. 9.7% in the S&P 500.
Previously: Direxion launched an ETF with iBillionaire today

 ",0.7808,positive,0.777874358974359
412,2014-11-18,0.1,Facebook launches standalone Groups apps,"

Continuing its efforts to build (in Mark Zuckerberg's words) ""a pipeline of experiences"" on mobile, Facebook (FB +0.3%) has created standalone Android/iOS apps for monitoring and interacting with one's groups.
Group-related notifications are provided through the app, as is a Discover tab that recommends groups based on a user's interests. However, unlike with messaging, Facebook won't be removing Groups functionality from its core apps.
The Groups launch follows the October release of Rooms, an app that allows users to create discussion spaces while logging in with pseudonyms.
Separately, Hilliard Lyons' Stephen Turner has launched coverage on Facebook with a Buy rating and $92 target. Like others, Turner cites Facebook's ability to benefit from a shift in ad spend towards online/mobile channels - mobile still only accounts for 11% of U.S. ad spend vs. 25% of media time.
 ",0.9831,positive,0.777874358974359
413,2014-10-28,0.49,"Facebook talks spending, ad prices/measurement, Oculus on CC","

Facebook's (NASDAQ:FB) aggressive 2015 spending forecast isn't driven by any particular field, but by large investments in everything from the core service to ad tech to new products, CFO Dave Wehner insisted on the CC. He suggested much of the new spending will be on hiring. (live blogs: I, II)
Price per ad soared 274% Y/Y in Q3, thanks in part to an overhaul of Facebook's right-hand column PC ads (they typically carry lower prices). With total ad revenue up ""only"" 64%, ad impressions fell 56% (fewer ads are shown on mobile).
PC ad sales rose 11% Y/Y, but were flat Q/Q. Though payments/other revenue rose 13% Y/Y, payments volume from games fell 2% due to lower PC gaming activity (a negative for ZNGA, which is down 1% AH).
Sheryl Sandberg notes only 11% of ad budgets are for mobile, and predicts improving inaccurate measurement systems (previous) will boost ROI and spending. She reiterates Facebook will take it slow in ramping Instagram and video ads, and that Facebook is aiming for Instagram to eventually have 1B users of its own (up over 4x from current levels).
Mark Zuckerberg cautions Oculus is unlikely to see 50M-100M unit shipments in the next few years, but reiterates he wants Oculus' VR headsets to be a mass-market product long-term. He also states Facebook plans to make new investments in growing public content viewing/sharing, where its focus on privately connecting friends/family can make for a tricky balancing act.
Facebook discloses WhatsApp (just beginning to monetize) had 2013 revenue of just $10.2M, and a loss of $138M ($98.8M from stock compensation).
Other details: 1) Of the 33M MAUs added in Q3, only 6M came from North America and Europe. 2) ARPU rose to $2.40 from $2.24 in Q2 and $1.72 a year ago. North American ARPU ($7.39) remains an outlier. 3) 456M MAUs (34% of them) are mobile-only.

FB -9.4% AH. Prior earnings coverage.
 ",0.9919,positive,0.777874358974359
414,2014-10-28,0.49,"Facebook -8.4% AH on revenue, spending guidance","
 Facebook (NASDAQ:FB) guides on its Q3 CC for Q4 revenue to be up 40%-47% Y/Y; that's in-line with a consensus of 44.7% growth, and slightly below at the midpoint. The company now expects 2014 GAAP costs/expenses to rise 45%-50% (boosted by WhatsApp stock compensation expenses), up from a prior outlook of 30%-35%. It also forecasts non-GAAP spending will rise 50%-70% Y/Y in 2015 - CFO Dave Wehner calls 2015 a ""significant expense"" year. Live blogs: I, II


Q3 results, details
  ",0.817,positive,0.777874358974359
415,2014-10-28,0.49,Facebook's ad sales continue surging; spending picks up,"

Facebook's (NASDAQ:FB) ad revenue rose 64% Y/Y in Q3 to $3.2B, just a slight slowdown from Q2's 67% clip. Mobile was 66% of ad revenue, up from 62% in Q2 and 49% a year ago. Payments/other revenue rose 13% to $246M, faster than Q2's 9% clip.
User growth slowed a bit: Monthly active users (MAUs) +2% Q/Q and +14% Y/Y to 1.35B, and mobile MAUs +5% Q/Q and +29% Y/Y to 1.12B. Q/Q growth was respectively 3% and 6% in Q2.
Daily active users (DAUs) +4% Q/Q and +19% Y/Y to 864M. DAUs equaled 64% of MAUs, up from 63% in Q2 and 61% a year ago (higher engagement).
GAAP costs/expenses +41% Y/Y to $1.81B, a pickup from Q2's 22% growth. R&D spend +65% to $608M, sales/marketing +61% to $374M, G&A +51% to $259M.
Free cash flow +15% to $766M, less than net income of $1.15B. $482M was spent on capex (15% of revenue).

FB -0.6% AH. Q3 results, PR, slides (.pdf)
 ",0.9911,positive,0.777874358974359
416,2014-10-28,0.49,"Facebook beats by $0.03, beats on revenue","

Facebook (NASDAQ:FB): Q3 EPS of $0.43 beats by $0.03.
Revenue of $3.2B (+58.4% Y/Y) beats by $80M.
Shares -1.4%.
 ",0.3111,positive,0.777874358974359
417,2014-10-23,1.67,"Facebook launches Rooms app, lets users rely on pseudonyms","
Rooms, a Facebook (FB +2.6%) app launching today on iOS (Android support should arrive in time), allows users to create discussion spaces (i.e. rooms) on specific topics. The rooms can contain text, photos, and videos, as well as comments from other users.Notably, the app doesn't require users to give their real names (a pseudonym will do), or even have a Facebook account. Invites to an individual room can be obtained by taking a picture or screenshot of a room's QR code.The app, vaguely outlined in an Oct. 7 NYT report, is arguably a response by Facebook to the popularity of pseudonymous discussion platforms such as Twitter, Reddit, and legions of Web message boards, and a recognition of the limits on discussion that stem from Facebook's real-identity requirement and focus on connecting with friends/family.Josh Miller, head of the team responsible for Rooms: ""We don’t want this to be a place where you talk to friends ... There are many people out there that you didn’t go to high school with that you want to connect with."" He adds the app is meant to be media-intensive. ""If links are the currency of the web, photos are the currency of mobile.""While Facebook's core services, Instagram, and WhatsApp continue faring quite well, the same doesn't hold for many of the new Facebook apps launched over the last two years. Examples include Flipboard alternative Paper, Snapchat alternative Slingshot, the Home Android UI, and Instagram's Hyperlapse app.Update: Miller shares more thoughts on Rooms in a TechCrunch interview. ",0.9862,positive,0.777874358974359
418,2014-10-20,1.0,Contrafund boosts bet on Facebook,"
""We continued to favor the stock, in large part due to its mobile-advertising business and visionary management team, and we added to the fund's stake during the quarter,"" says a commentary letter from Will Danoff's Fidelity Contrafund (MUTF:FCNTX) to investors today.The fund didn't say how many shares it ended Q3 with, but had 42M shares of Facebook at the end of August, up from 36M at the end of 2013, with the stock accounting for 2.8% of AUM.Facebook (NASDAQ:FB) easily outpaced the S&P 500 both in Q3 and YTD, and Contrafund returned 1.77% in Q3 vs. the S&P's 1.13% advance.Other share class: FCNKX ",0.9608,positive,0.777874358974359
419,2014-10-17,3.32,Facebook's market cap tops IBM's; partner reports strong Q3 numbers,"

Thanks to its relatively strong October performance, Facebook's (FB +4.6%) market cap ($188.8B) is bigger than IBM's ($179.4B). The 10-year-old company now has the 5th-highest market cap in the tech universe, behind only Apple, Google, Microsoft, and Alibaba.
Meanwhile, Facebook partner Nanigans (provides software for managing Facebook ad campaigns) reports (.pdf) its clients saw their ad click rates rise 56% Q/Q and 195% Y/Y to 0.56%. Y/Y growth improved from 146% in Q2.
The average prices for 1K ads sold on a CPM basis rose 80% Q/Q and 298% Y/Y to $2.98, while the average price for individual ads sold on a CPC basis fell 4% Q/Q and rose 30% Y/Y to $0.53. Mobile made up 62% of spending, up from 56% in Q2.
Nanigans attributes the huge CPM growth to strong demand for news feed ads - their CPM rose 153% Y/Y to $5.62 - declining interest in cheaper right-hand column ads, larger right-hand column ad units, and (perhaps more interestingly) a 38% Q/Q increase in the use Facebook's Optimized CPM platform, which gives advertisers more control over campaigns and delivers better targeting.
Facebook, of course, has made many other efforts to improve targeting. Q3 results arrive on Oct. 28.
 ",0.9945,positive,0.777874358974359
420,2014-10-14,0.6,Goldman: Every client asking about the same four things,"

Global growth, foreign-exchange, oil, and small caps are the subject of every client inquiry, says David Kostin. His team's recommendation: Buy ""American exceptionalism.""
In Kostin's view, U.S. economy and corporate fundamentals are still strong, with economic growth expected by Goldman economists to be 3.2% next year, the fastest expansion since 2005. Europe is expected to grow just 1%.
What his team likes are those stocks of companies which have a high proportion of domestic sales, plus sectors like Consumer Staples (XLP -0.1%) and Discretionary (XLY +0.7%) which stand to benefit from lower oil prices (plunging again today).
As for small caps (IWM +0.9%), Kostin is wary, noting downward earnings revisions have boosted small cap P/E ratios even as prices have declined.

The list of S&P 500 names capturing two or more of Kostin's themes: GT, GM, PCLN, AMZN, CMCSA, LOW, DG, TSN, ADM, CVS, AVP, WAG, PXD, HAL, JPM, BAC, SCHW, PNC, MS, C, GNW, LNC, MET, THC, AET, UNH, ESRX, HUM, WLP, BIIB, GILD, DAL, CMI, FLR, CRM, JBL, MA, FB, MU, FSLR, VMC, MON, T.
 ",0.962,positive,0.777874358974359
421,2014-09-29,0.21,"Facebook roundup: Atlas, Instagram, Ello","

Facebook (FB +0.2%) has officially launched an overhauled version of its Atlas ad-measurement/serving platform. As previously reported, the revamped Atlas uses Facebook profile info to allow advertisers to track the performance of Facebook and non-Facebook ads, and (leveraging Facebook data) also allows them to make automated ad buys for inventory on 3rd-party sites/apps.
Instagram and ad giant Omnicom are among the first supporters. Marin Software (MRIN -0.3%) is among the ad tech supporters - its platform will be integrated with Atlas to allow clients to better measure their ROI on search ad campaigns.
Interestingly, Re/code reports hearing Facebook has ""talked to Twitter"" about supporting Atlas. The site adds some think Facebook's main goal with the platform is to leverage the data it obtains about 3rd-party ad sales to improve the effectiveness of its internal ad sales.
Instagram has been blocked in China as protests erupt in Hong Kong. Until now, the photo-sharing platform has been available in China even as Facebook's core services are generally blocked. Many Chinese celebrities claim 100K+ Instagram followers.
Ello, a new social network that pitches itself as the anti-Facebook - it refuses to sell ads, and plans to monetize by charging for value-added features - has been quickly gaining users. According to one estimate, over 35K people have been asking to sign up per hour.
With Facebook claiming 1.32B MAUs at the end of Q2 (204M in North America), its network effect remains a big hurdle for Ello and other would-be rivals.
 ",0.9914,positive,0.777874358974359
422,2014-09-23,1.49,Facebook goes after Google with new ad tech platform,"

More than 18 months after buying Microsoft's Atlas ad measurement/serving platform, Facebook (FB +1.8%) is about to launch a revamped version of Atlas that will allow advertisers to measure the performance of ads seen and/or clicked on by Facebook users both on Facebook and (notably) 3rd-paty sites and apps.
By anonymously linking ad measurement to Facebook profiles, Facebook aims to once more leverage its user data for ad targeting (previous), and provide better tracking across PCs and mobile than is possible via cookies. Atlas will also feature a programmatic (automated) ad-buying interface for marketers.
As The Information reported last month, Facebook aims to use a revamped Atlas, its mobile ad network, and LiveRail's video ad platform (together with its data) to offer a full ad tech ""stack"" that can challenge Google's (GOOG -1.1%) huge DoubleClick display ad unit for the dollars of marketers buying ad inventory on 3rd-party sites/apps.
Naturally, Google hasn't been standing idly either. The company bought ad measurement platform Adometry last spring, and has been working on tools to better track cross-device and offline activity. The company has also launched an app install ad service (competes against Facebook's very popular offering) for AdWords search ads.
 ",0.9888,positive,0.777874358974359
423,2014-09-11,0.49,"Apple back above $600B in market cap, Exxon hangs on vs. Google for no. 2","

After moving back above the $100/share level, Apple (NASDAQ:AAPL) is back over the $600B mark in market cap, pushing it nearly $200B above Exxon Mobil (NYSE:XOM), the next largest company in the U.S.
XOM is still valued at more than $400B, but Google (NASDAQ:GOOG) at $397B and Microsoft (NASDAQ:MSFT) - which has surged in 2014, adding $74B in market cap to $386B - are closing the gap.
Berkshire Hathaway (NYSE:BRK.B) completes the top five with a $339B market cap; no other companies are worth more than $300B.
Rounding out the top 20 market caps: JNJ, WFC, GE, WMT, CVX, PG, JPM, FB, VZ, IBM, PFE, KO, ORCL, T, MRK.
 ",0.4244,positive,0.777874358974359
424,2014-08-25,0.45,WhatsApp hits 600M MAUs; Facebook tops comScore app list,"

WhatsApp (FB +0.6%) now has over 600M monthly active users (MAUs), CEO Jan Koum declares. The mobile messaging leader had only topped 500M in April, and had 450M at the time the Facebook deal was announced in mid-February.
Mark Zuckerberg has long been confident WhatsApp will eventually have over 1B users, and has even reportedly suggested WhatsApp could eventually have a bigger base than Facebook proper. Facebook claimed 1.32B MAUs at the end of Q2.
Meanwhile, comScore estimates Facebook's core app had 115.4M U.S. unique visitors in June, 32M more than the second-most-popular U.S. app (YouTube) and good for a 72% penetration rate. Globally, Facebook had 1.07B mobile MAUs at the end of June.
comScore estimates Instagram had 46.6M U.S. users (#8 overall), and Facebook Messenger 39.2M (#12). WhatsApp, often used as an SMS replacement abroad, didn't crack the top-25, as U.S. users continue relying heavily on the SMS services often bundled with their mobile plans.
Not surprisingly, comScore's data also suggests core Facebook's U.S. base skews older, and Instagram's base skews younger. Whereas core Facebook accounts for 18.4% of the time spent on apps by U.S. users aged 35-54, it accounts for 14.8% among those aged 18-24. Whereas Instagram accounts for just 1.2% of the time spent by the former group, and 6.6% of the time spent by the latter.
 ",0.9628,positive,0.777874358974359
425,2014-07-24,3.69,Facebook makes new highs; Q2 ad performance well-received,"

""We think 2Q represents further validation that Facebook (FB +5.5%) can continue to drive mobile ad revenue growth through better ad targeting, relevancy and quality, and through continued growth in advertiser demand in its ad auction,"" writes JPMorgan, bullish as ever following Facebook's Q2 beat.
Needham estimates Facebook now ""accounts for $1 of every $5 ad dollars spent on mobile devices."" SunTrust observes the Q2 growth came in spite of little or no revenue from a slew of long-term initiatives, including video ads, Instagram, Buy button ads, WhatsApp/Oculus, and the mobile ad network.

Jefferies makes a similar point. It adds Facebook's ""ever-deepening ties"" to e-commerce leave it well-positioned to ""capitalize on strong holiday shopping trends."" Others are encouraged by Mark Zuckerberg's CC remarks (transcript) about future payments integration for Messenger, and his claim that the average U.S. user spends 40 minutes/day on Facebook.
Shares are making new highs, and now trade at a steep 12x 2015E sales. Revenue estimates should rise some in response to the Q2 numbers.
Prior Facebook earnings coverage
 ",0.9846,positive,0.777874358974359
426,2014-07-23,2.02,"Facebook now +5.3% AH; ad prices soar, impressions drop","

Facebook (NASDAQ:FB) will make efforts to accept more payments on its platform, says Mark Zuckerberg on the Q2 CC following a question about Facebook's Buy button and related payments tools (still in testing). However, he adds advertising (92% of Q2 revenue) will remain the company's main business.
Zuck also reiterates (in spite of Facebook's efforts to grow public sharing) creating private spaces for users remains a core objective. He states Messenger (now run by ex-PayPal chief David Marcus) will play a pivotal role in furthering this goal. WhatsApp presumably will also play a role.
New CFO David Wehner states Facebook's ad prices effectively more than doubled Y/Y due to a shift towards more costly news feed/mobile ads (improved targeting also didn't hurt). This enabled ad sales to rise 67% in spite of a 25% drop in ad impressions.
Sheryl Sandberg notes the acquisition of video ad tech platform LiveRail will further Facebook's ad network ambitions; the company just recently launched its mobile ad network. She also declares marketers are getting more creative with Facebook campaigns, comparing them to TV campaigns in the process.
Facebook now has 399M mobile-only MAUs (30% of all MAUs). North America made up 44% of Q2 revenue, down from 47% in Q1. North American ARPU ($6.44) still dwarfs Facebook's global ARPU ($2.24).
Live blogs: I, II, III.
Prior Facebook earnings coverage
 ",0.9827,positive,0.777874358974359
427,2014-07-23,2.02,Mobile 62% of Facebook's ad sales; MAUs rise 14% Y/Y,"

Facebook's (NASDAQ:FB) ad revenue rose 67% Y/Y in Q2 to $2.68B; Q1 growth was 82%. Mobile ad sales made up 62% of ad revenue, up from 59% in Q1 and 41% a year ago. Payments/other fees revenue rose 9% Y/Y to $234M.
Monthly active users (MAUs) +3% Q/Q and +14% Y/Y to 1.32B. Daily active users +3% Q/Q and +19% Y/Y to 829M. Mobile MAUs +6% Q/Q and +31% Y/Y to 1.07B (81% of total MAUs).
GAAP costs/expenses +22% Y/Y to $1.52B, a slowdown from Q1's 26% and Q4's 37%. R&D spend +43% to $492M, sales/marketing +33% to $358M.
Free cash flow was $872M, below net income of $1.09B. $469M was spent on capex.

FB +0.1% AH. Q2 results, PR, slides (.pdf).
 ",0.9874,positive,0.777874358974359
428,2014-07-23,2.02,"Facebook beats by $0.10, beats on revenue","

Facebook (NASDAQ:FB): Q2 EPS of $0.42 beats by $0.10.
Revenue of $2.91B (+60.8% Y/Y) beats by $110M.
 ",0.0175,positive,0.777874358974359
429,2014-07-21,0.98,"Facebook unveils content-saving service, might use it for ad targeting","

Facebook (FB +1.7%) has launched Save, a feature for its site and apps that allows users to create a stored list of Facebook content (posts, places, music, video, etc.) that caught their attention.
A prominent Save button will be placed on pages for places and media content. Facebook will also occasionally publish news feed reminders linking to previously-saved content.
If the service sounds familiar, it might be because it bears a strong resemblance to link-saving services such as Pocket and Instapaper. But Facebook's offering is focused on its own content. It also doesn't support offline caching for now.
When asked by TechCrunch whether Save would be used to improve ad targeting, the company stated targeting based on saved content currently isn't supported, but added it will ""explore this more in the coming months."" Facebook already makes heavy use of its volumes of data on user likes/interests to deliver targeted ads.
Q2 results arrive on Wednesday.
 ",0.9129,positive,0.777874358974359
