,Date,changed,title,details,news_score,news_result,average
0,2018-12-27,0.34,Facebook: Bug caused Instagram feed change,"
Facebook's (FB -1.6%) Instagram temporarily switched to a horizontal feed today and users weren't happy.Instagram head Adam Mosseri tweeted an apology, saying it was ""supposed to be a very small test but we went broader than we anticipated.""But in a statement to The Verge, a Facebook spokesperson blamed the switch on a bug and apologized for any confusion. ",-0.4945,negative,0.777874358974359
1,2018-12-26,10.12,Citron boosts Facebook; shares up 3.5%,"
""Backing up the sleigh,"" on Facebook (NASDAQ:FB), tweets Andrew Left.Look past the rhetoric, he urges. ""Would you rather have your kids addicted to Nicotine or Instagram? Wall Street answer will amaze you.""Full report hereHis $160 price target suggests 30% upside from Monday's close. Shares this morning are up 3.5% to $128.50. ",0.8953,positive,0.777874358974359
2,2018-12-20,0.16,FT: WhatsApp bans 130K accounts in 10 days,"
Facebook's (NASDAQ:FB) WhatsApp has banned 130K user accounts in the past 10 days for sharing illegal material related to child sex abuse, according to Financial Times.WhatsApp has a total user base of about 1.5B.Sources say videos and pictures showing abuse are shared ""on a vast scale"" and WhatsApp isn't curbing the problems despite mass bans.In September, Israeli researchers warned Facebook it was easy to find and join groups sharing that type of content. FT found several of the identified groups were still active this week.WhatsApp's end-to-end encryption means the company (and law enforcement) can't see the content of messages, which makes it harder to check for illegal material.WhatsApp says it “has a zero-tolerance policy around child sexual abuse.”Facebook shares are down 0.9% premarket to $132. ",0.1209,positive,0.777874358974359
3,2018-12-13,0.51,Facebook pushes back on story dinging fact-check program,"
 Facebook (FB -0.2%) is fighting on another front today, responding to a scathing Guardian piece suggesting journalists are fleeing a high-profile fact-checking program that the company set up to combat fake news but which is now in disarray. The report says current and former fact-checkers say their collaboration with Facebook has produced minimal results and that they've lost trust in the company. ""They've essentially used us for crisis PR,"" says the former managing editor of Snopes. Facebook says it provided info to The Guardian but the paper chose not to include all of it. ""Contrary to a claim in the story, we absolutely do not ask fact-checkers to prioritize debunking content about our advertisers,"" the company says, arguing that instead potential fake news is surfaced via machine learning. In response to another claim in the story -- that Facebook has repeatedly refused to release meaningful data about the impact of the fact-checking effort -- the company says it's heard feedback and ""we’re starting to send fact-checkers quarterly reports that include customized statistics that reflect the work and impact of each fact-checker.""  ",0.0752,positive,0.777874358974359
4,2018-12-13,0.51,"Facebook: Watch has 400M monthly users, 75M daily users","
 With news about video-news funding changes in the air, Facebook (FB -0.2%) has issued an update on its ambitious video-programming efforts. More than 400M monthly users spend at least one minute on Facebook Watch, the company says, and more than 75M daily. On average, the 75M daily visitors spend more than 20 minutes in Watch. Amid the news about high-profile news shows getting less funding on Watch, Facebook says it will keep funding original programming, including renewing four programs for a second season: Huda Boss, Five Points, Sacred Lies, and Sorry For Your Loss. It's also giving some focus to the community aspect of its Watch tab, saying it's seen more than 12M real-time ""Watch Parties"" in Facebook's Groups, and that Watch Parties garner eight times more comments than regular videos in Groups. Meanwhile, after initially launching Ad Breaks to five countries in August, the company has now made the ad opportunities available to eligible pages in 40 countries.  ",0.9641,positive,0.777874358974359
5,2018-12-13,0.51,Report: Facebook cutting back some news video funding,"
 Facebook (FB +0.3%) is cutting back on investment in particular news programming for its video tab, The Information reports. That comes just months after a splashy launch of original programming from outlets including CNN, ABC and BuzzFeed. Overall spending on news content for the ""Watch"" tab is expected to remain the same (about $90M), but spread across a wider list of programs, according to the report, including the likelihood that more of that money will fund overseas news rather than the higher-profile programs.  ",0.8252,positive,0.777874358974359
6,2018-12-12,2.42,"Facebook, ZeniMax settle suit over Oculus VR tech","
 Facebook (FB +3.1%) and videogame maker ZeniMax have settled a lawsuit where the social-media giant was accused to stealing ZeniMax's secrets and technology for use in Oculus virtual-reality products. Terms weren't disclosed, but both companies expressed happiness with the outcome. “We’re pleased to put this behind us and continue building the future of VR,” says a Facebook spokesperson. Oculus Chief Technology Officer John Carmack was previously a ZeniMax employee, and ZeniMax said he used that knowledge to improve the Oculus Rift headset. It also said Oculus founder Palmer Luckey took code and proprietary info to develop Oculus products.  ",0.9583,positive,0.777874358974359
7,2018-12-11,0.23,Report: Japan to increase scrutiny of foreign big-data firms,"
 Japan's government is going to set up an oversight panel to keep a closer eye on foreign ""big data"" companies that deal with concentrated information from consumers and small businesses, Nikkei reports. That affects the usual tech suspects: Facebook (NASDAQ:FB), Amazon.com (NASDAQ:AMZN), Netflix (NASDAQ:NFLX), Google (GOOG, GOOGL), and even Alibaba (NYSE:BABA), among others. The panel is expected to be established as soon as 2020, according to a draft report, and a framework should be in place by next summer. Meanwhile, Japan's Fair Trade Commission will survey the IT industry as early as January with an eye to finding illegal business practices or contracts.  ",0.9562,positive,0.777874358974359
8,2018-12-11,0.23,Facebook testing search advertising as new revenue stream,"
 Facebook (FB +0.6%) is starting to test search ads, from its search bar and in Marketplace, in the U.S. and Canada. That squares off against AdWords from fellow duopolist Google (GOOG +1%, GOOGL +0.7%). It's a return of sorts to such advertising for Facebook, which shut down Sponsored Results five years ago but now could see an important revenue stream. The ads will be repurposed News Feed ads starting from a small set of automotive, retail and e-commerce advertisers, TechCrunch notes.  ",0.7617,positive,0.777874358974359
9,2018-12-11,0.23,Invesco QQQ ETF (QQQ) November Summary,"
November monthly performance was: -1.96%AUM of $66B52-week performance vs. the S&P 500 is: +5%$0.33 in dividends were paid in NovemberTop 10 Holdings as of 11/29/2018: Apple Inc (AAPL): 10.91098%, Microsoft Corp (MSFT): 10.63103%, Amazon.com Inc (AMZN): 10.26999%, Alphabet Inc Class C (GOOG): 4.79084%, Facebook Inc A (FB): 4.20797%, Alphabet Inc A (GOOGL): 4.11657%, Cisco Systems Inc (CSCO): 2.80112%, Intel Corp (INTC): 2.76728%, Comcast Corp Class A (CMCSA): 2.26782%, PepsiCo Inc (PEP): 2.10457% ",0.6276,positive,0.777874358974359
10,2018-12-10,4.43,U.S. stock markets mixed as Nasdaq edges up,"
The tech-heavy Nasdaq creeps up to a gain in early afternoon trading as the Dow and S&P 500 pare earlier losses.Nasdaq +0.2%, S&P -0.5%, Dow -0.7%.By sector, technology rises 0.3%. Among individual stocks, Alphabet (GOOG +0.1%), Facebook (FB +2.1%), and Microsoft (MSFT +1.2%) advance.Financials -1.4% and basic materials -1.4%, which includes oil & gas, experience the biggest sector declines. Individual laggards include Wells Fargo (WFC -3%), Bank of America (BAC -2.9%), Citi (C -2.4%), Occidental Petroleum (OXY -3.5%), Exxon Mobil (XOM -2.4%), and EOG Resources (EOG -2.7%).Crude slides 1.5% to $51.81.U.S. 10-year Treasury price slips, lifting yield by almost 1 basis point to 2.86%. Dollar index rises 0.5% to 97.14.Previously: Stock losses mount amid growth concerns, trade uncertainty (Dec. 10) ",0.8244,positive,0.777874358974359
11,2018-12-10,4.43,Report: Zuckerberg turns to Microsoft's Smith for advice,"
The Information sources say Facebook (FB +2.2%) CEO Mark Zuckerberg has spoken to Microsoft (MSFT +0.2%) president and CLO Brad Smith for advice on how to rebuild trust at his company.Zuckerberg occasionally turns to Bill Gates for advice and Gates recommended speaking with Smith.Though the discussion wasn't a formal job offer, Smith told Zuckerberg he was happy at Microsoft. ",0.853,positive,0.777874358974359
12,2018-11-30,1.93,Report: Facebook hired Republican strategy firm,"

Facebook (NASDAQ:FB) quietly hired Republican strategy firm Targeted Victory, according to TechCrunch sources.
Facebook worked with Targeted Victory on the Community Boost roadshow, which pushed Facebook as a business and ad opportunity for small businesses, and on its ad transparency efforts.
Facebook hosted Targeted Victory members twice this year for panels on ad transparency, election integrity, and election best practices. It's not clear if Facebook disclosed a financial relationship at the time.
Targeted Victory, PR firm Definers, and Facebook's communications team all have ties to Mitt Romney's presidential campaign.
Facebook shares are down 0.5% premarket.
Previously: Facebook admits Sandberg requested Soros research (Nov. 30)
 ",0.9919,positive,0.777874358974359
13,2018-11-30,1.93,Facebook admits Sandberg requested Soros research,"

BuzzFeed News reports that Facebook (NASDAQ:FB) COO Sheryl Sandberg requested research on company critic George Soros, contrary to Sandberg's prior claim that she was unaware of the work done by opposition research firm Definers.
Facebook acknowledged its ties to Definers after a New York Times report but said Sandberg and CEO Mark Zuckerberg had little to no knowledge of the firm's work.
A FB spokesperson now admits that Sandberg did request research on Soros but says she did not direct Definers.
Key quote from the statement: ""Mr. Soros is a prominent investor and we looked into his investments and trading activity related to Facebook. That research was already underway when Sheryl sent an email asking if Mr. Soros had shorted Facebook's stock. Sheryl never directed research on Freedom from Facebook. But as she said before she takes full responsibility for any activity that happened on her watch.""
Previously: Facebook publishes memo where policy chief owns up to PR firm hiring (Nov. 21)
Previously: Open Society head wants Facebook oversight (Nov. 23)
 ",0.9927,positive,0.777874358974359
14,2018-11-29,1.92,Facebook debated charging for user data access?,"

Internal Facebook (NASDAQ:FB) emails in court filings viewed by the WSJ provide a window into a document trove a British lawmaker plans to make public next week - based on a lawsuit filed by a company called Six4Three.
The emails - mostly from 2012 to 2014 - suggest Facebook considered charging companies for continued access to user data and may have pushed some advertisers to spend more in return for increased access to user information.
 ",0.8405,positive,0.777874358974359
15,2018-11-28,1.76,Rights groups press for secret docs in Facebook Messenger case,"
 Civil rights groups are pressing a judge to release documents around a secret effort to force Facebook (NASDAQ:FB) to decrypt voice calls on its Messenger app. The public right to know encryption laws outweighs reasons the Justice Dept. might have for protecting a criminal probe, say the ACLU and Electronic Frontier Foundation via a joint motion. The government was reportedly pressing for an encryption break in the summer, around a gang investigation. That attempt failed, Reuters reported. The groups compared this legal fight to a 2016 dispute where the FBI asked courts to force Apple to break into an iPhone related to the San Bernardino, Calif., shootings that year. They say it's vital to the privacy debate about government's authority over tech companies.  ",0.5486,positive,0.777874358974359
16,2018-11-28,1.76,Facebook expands locally focused news feature,"
 Facebook (FB -1.7%) is ramping up its local focus, expanding a new section called ""Today In"" that's specialized for more than 400 U.S. cities. Tests of the feature began earlier this year as surveys indicated people wanting to see more content, including that typically understood as ""local news"" as well as community information for planning, including such things are road closures and bus schedules. Now it's testing the feature in ""news deserts"" with low supply of that information. It's also running a test with more than 100 local government and first responder Pages to help them get important information out. Facebook also launched its first international test of ""Today In,"" in Australia.  ",0.9694,positive,0.777874358974359
17,2018-11-26,4.65,Facebook shutters crisis 'War Room'; Sandberg under fire,"
 Facebook (FB +3.1%) has disbanded a ""War Room"" that it was showing off to reporters just two months ago as part of an effort to demonstrate its seriousness in tackling issues including election misinformation, Bloomberg says. That's part of a larger report offering new dents to the reputation of Chief Operating Officer Sheryl Sandberg. Eight current and former employees from Sandberg's side of the organization blame her for company problems due to missteps including prioritizing her brand over the company's, filtering out bad news, and slow-playing serious problems. Scrutiny over the past couple of years has centered on CEO Mark Zuckerberg, but after a scathing NYT report, ""she is always going to be tainted,"" one employee source told Bloomberg. On the War Room, Facebook says it was never intended to be permanent and suggests its strategic response team is a more permanent solution to addressing crisis problems. (h/t CNBC)
Previously: Facebook publishes memo where policy chief owns up to PR firm hiring (Nov. 21 2018)
Previously: Facebook near 2-year low amid 'crisis'; has it hit 'AOL/Yahoo peak'? (Nov. 19 2018)
Previously: Sonnenfeld: Facebook should replace 'dispensable' COO Sandberg (Nov. 16 2018)  ",-0.6555,negative,0.777874358974359
18,2018-11-26,4.65,U.K. seizes Facebook internal papers,"

Internal Facebook (NASDAQ:FB) documents have been seized by the U.K. parliament via a rare parliamentary power that will likely set the tone for a high-stakes hearing due to take place this week.
The files are reported to contain confidential emails about Facebook decisions on data and privacy controls that led to the Cambridge Analytica scandal.
They also likely include confidential emails between senior executives, and correspondence with CEO Mark Zuckerberg.
 ",0.6511,positive,0.777874358974359
19,2018-11-21,2.39,Facebook publishes memo where policy chief owns up to PR firm hiring,"
 After an internal memo from its outgoing head of public policy Elliot Schrage leaked, Facebook (NASDAQ:FB) has published the memo in full, where Schrage takes responsibility for hiring the PR firm Definers.
That effectively provides cover for denials about the firm from CEO Mark Zuckerberg and COO Sheryl Sandberg in the wake of a scathing NYT piece on Facebook leadership. And Sandberg has commented on the memo as well. The Republican-backing opposition research firm (mentioned in the NYT piece) was originally tapped by Facebook to monitor press coverage of the company before expanding its work to include going aggressively after competitors. That included promoting conspiracy theories tying Facebook criticism to Democratic donor George Soros, who had called the company a ""menace to society."" ""We had not heard such criticism from him before and wanted to determine if he had any financial motivation,"" Schrage writes. ""Responsibility for these decisions rests with leadership of the Communications team,"" he goes on. ""That’s me. Mark and Sheryl relied on me to manage this without controversy."" He justifies the use of opposition research to tackle Facebook's opponents. But Facebook didn't ask Definers to distribute or create fake news, he says. Sandberg added comment at the bottom: ""I want to be clear that I oversee our Comms team and take full responsibility for their work and the PR firms who work with us. ""When I read the story in New York Times last week, I didn’t remember a firm called Definers. I asked our team to look into the work Definers did for us and to double-check whether anything had crossed my desk. Some of their work was incorporated into materials presented to me and I received a small number of emails where Definers was referenced. ""I also want to emphasize that it was never anyone’s intention to play into an anti-Semitic narrative against Mr. Soros or anyone else,"" she writes.  ",0.9877,positive,0.777874358974359
20,2018-11-21,2.39,Facebook appeals £500K fine in Britain over data scandal,"
 Facebook (FB +2.8%) is appealing a fine of £500,000 (about $639K) it received from UK regulators over the Cambridge Analytica scandal. The company says the fine was based on UK Information Commissioner's Officer concerns that the incident affected the data of British citizens. The ICO just wrapped an investigation and hasn't found evidence that British data were passed to Cambridge Analytica. “Therefore, the core of the ICO’s argument no longer relates to the events involving Cambridge Analytica.""  ",-0.2044,negative,0.777874358974359
21,2018-11-21,2.39,Zuck won't step down as Facebook chairman,"

Stepping down as Facebook (NASDAQ:FB) chairman in the near term is ""not the plan,"" Mark Zuckerberg told CNN, after some big shareholders proposed to push him out of the role following a string of management missteps.
Zuckerberg also praised Facebook COO Sheryl Sandberg when asked if she would keep her job following a series of scandals, adding that he hopes to work together for ""decades more to come.""
Previously: WSJ: Zuckerberg aggressive with Facebook at war (Nov. 19 2018)
Previously: Sonnenfeld: Facebook should replace 'dispensable' COO Sandberg (Nov. 16 2018)
 ",0.7915,positive,0.777874358974359
22,2018-11-14,2.06,"NYT probes Facebook's crisis response of 'delay, deny, deflect' (updated)","
 A deep dive by The New York Times into a year of discontent at Facebook (NASDAQ:FB) paints a picture of the historically unique company's executive response to being beset by crisis after crisis: ""Delay, deny and deflect."" With Facebook becoming a powerful force in daily life around the globe, CEO Mark Zuckerberg and COO Sheryl Sandberg ""stumbled."" ""Bent on growth, the pair ignored warning signs and then sought to conceal them from public view,"" says the piece, in which more than 50 people were interviewed. ""At critical moments over the last three years, they were distracted by personal projects, and passed off security and policy decisions to subordinates, according to current and former executives."" Facebook responds by acknowledging that it has been slow to address challenges, but has made progress; in the meantime, lawmakers and the Trump administration have been working up proposals for a national privacy law, which would set off a lengthy battle over the future of Facebook's central business model. Troubles in the executive ranks were apparent in late 2015 when then-candidate Donald Trump used the platform for a call to shut down Muslim immigration, and they accelerated with news in 2016 that Russian hackers seemed to be probing Facebook accounts to find people connected to the presidential campaigns. Along the way, Facebook's political backing began to fracture under pressure from angry lawmakers from both the Democratic and Republican parties. Previously: WSJ: Morale at Facebook takes a hit in challenging year (Nov. 14 2018) 
Updated 6:39 p.m.: David Cicilline -- ranking member of the antitrust subcommittee of the House Judiciary Committee for the Democrats, set to take over the House -- says in response to the piece ""Facebook cannot be trusted to regulate itself. This staggering report makes clear that Facebook executives will always put their massive profits ahead of the interests of their customers ... It is long past time for us to take action."" FB is down 0.3%.
 ",-0.1015,negative,0.777874358974359
23,2018-11-14,2.06,"Jana Partners adds Dollar Tree, Exact Sciences; exits ADT, Facebook, GreenSky","

Jana Partners files its form 13F disclosing its stock holdings for quarter ended Sept. 30, 2018.
Adds Arlo Technologies (ARLO -2.7%), Dollar Tree (DLTR -0.4%), Exact Sciences (EXAS -2.3%), Falcon Minerals (FLMN -1.8%), Hain Celestial (NASDAQ:HAIN), Summit Materials (SUM +3.9%), US Steel (X -0.2%), Zoetis(ZTS -1.5%)
Exits ADT (ADT -0.4%),  Alphabet (GOOG -0.3%), Altice USA (ATUS -2%), Brightview Holdings (BV +1.2%), Facebook (FB -0.1%), GreenSky (GSKY -2.1%), Perspecta Inc. (PRSP -0.6%), RPM (RPM +0.3%), TPG Pace Energy Holdings (TPGE.U), Wells Fargo (WFC -0.6%).
Previously: JANA and Jack in the Box in standstill agreement (Oct. 26)
Previously: Jana Partners a buyer of Exact Sciences; shares up nearly 2% (Oct. 3)
 ",0.9075,positive,0.777874358974359
24,2018-11-14,2.06,WSJ: Morale at Facebook takes a hit in challenging year,"
 Morale is getting a thumbs-down at Facebook (FB +1.3%), with internal measures showing a sharp turndown amid the past year's challenges, The Wall Street Journal reports. An internal ""pulse"" survey taken by nearly 29,000 employees shows just over half of them were optimistic about the company's future -- a drop of 32 percentage points from a year earlier, according to the report. And 53% said Facebook was making the world better, vs. 72% the prior year. While the workforce has been resilient in past challenges, this time may be different because declines in the stock price may be playing a bigger part in morale due to stock-option compensation. Many of the company's newest employees work in safety and security and have options worth less now than a year ago. Among other key answers, some employees indicated concerns with a sharper focus on growth and frustration over ""lack of innovation.""  ",0.939,positive,0.777874358974359
25,2018-11-13,0.61,DOJ's Delrahim speaks on antitrust approach in age of mergers,"
 In an interview with CNBC, DOJ antitrust chief Makan Delrahim was faced point blank with the weekend editorial by Columbia antitrust specialist Tim Wu, who said ""It would be understandable if you assumed that the Anti-Merger Act of 1950 had been repealed. But in fact it remains on the books. It has merely been evaded, eroded and enfeebled by the corroding effect of decades of industry pressure and ideological drift, yielding hesitant enforcers and a hostile judiciary."" ""I don't know if there's been much hostility; I think the laws have been pretty well calibrated,"" Delrahim says. ""Over the last 30-40 years we've had a pretty strong and bipartisan consensus ... on the right balance for antitrust enforcement ... Are there areas, do we wish it would go a different way? Are there cases we lose? Absolutely."" Asked how closely the department looks in particular at platforms that touch multiple aspects of people's lives, like Amazon.com (AMZN +1%), Facebook (FB +1.3%) and Alphabet (GOOG +0.7%, GOOGL +0.7%), he replies ""We're just there to police the markets. We're not picking winners and losers, we are not trying to choose which technologies -- frankly we're just not smart enough to be doing that. All we can do is make sure the markets are free, for new entrants to come in and topple the old ones."" And as for the president's tweets about antitrust matters, including weighing in on the ACA's pressure on Comcast (CMCSA -0.2%), Delrahim notes the consent decree tied to Comcast's purchase of NBCUniversal expired but it's his job to make sure markets work nonetheless -- and he reiterated his opposition to behavioral remedies to cure antitrust concerns. ""We come in and tell a company to withhold its natural tendencies, its natural incentives to make profit, and then they evaporate after five years, 10 years, seven years,"" he says. ""And it makes no sense because seven years before, we're trying to guess where the market is."" ""I believe in structural solutions,"" he adds, saying that's why DOJ was opposed to parts of the AT&T/Time Warner merger ""and that was the solution we provided."" There's been a lot of support for the DOJ's appeal of the AT&T (T -0.5%) decision, he says pointing to 29 supporting economists. ""We'll see what happens.""  ",0.9946,positive,0.777874358974359
