,Date,changed,title,details,news_score,news_result,average
272,2017-02-10,0.05,Zuck puts on the VR gloves,"
""I just visited our Oculus Research lab in Redmond, Washington where some of the best scientists and engineers in the world are pushing the boundaries of virtual and augmented reality,"" CEO Mark Zuckerberg wrote on Facebook (NASDAQ:FB).""We're working on new ways to bring your hands in virtual and augmented reality. Wearing these gloves, you can draw, type on a virtual keyboard, and even shoot webs like Spider-Man. That's what I’m doing here.” ",0.8451,positive,0.777874358974359
273,2017-01-26,1.3,Facebook increasing 'percent completion' weighting for longer videos,"
Facebook (NASDAQ:FB) already factors the percent of videos watched by users (""percent completion"") in ranking which are more valuable, and consequently surfaced in News Feed. The company now plans to calibrate that signal around video length.Longer videos, reportedly of heightening interest at Facebook, are therefore noted to prospectively increase slightly in News Feed distribution while shorter ones decrease slightly dependent on user viewing patterns.News Feed FYI: Updating How We Account For Video Completion Rates [Facebook] ",0.871,positive,0.777874358974359
274,2017-01-26,1.3,"Facebook, Google look to combat fake news","
Facebook (NASDAQ:FB) is updating Trending, the section that highlights popular topics being discussed on its platform, to better prevent fake news stories from appearing there.As part of the update, Facebook said it’s going to stop pulling in trending topics that surface based off a single news report.Meanwhile, Google (GOOG, GOOGL) kicked 200 publishers off one of its ad networks in the fourth quarter, partly in response to the proliferation of fake news sites. ",0.3147,positive,0.777874358974359
275,2017-01-26,1.3,Hugo Barra joins Facebook as VR chief,"
Tech veteran Hugo Barra is joining Facebook (NASDAQ:FB) to oversee the social network's virtual-reality efforts, including the work of the Oculus VR team.""Hugo shares my belief that virtual and augmented reality will be the next major computing platform,"" CEO Mark Zuckerberg said in a Facebook post.Barra, a former executive at Alphabet's Google, just left Chinese smartphone maker Xiaomi this week. ",0.6829,positive,0.777874358974359
276,2017-01-24,0.44,Instagram launching live Stories feature worldwide,"
Global availability will roll out over the next week, following initial introduction of the capability across Instagram's (FB +0.7%) U.S. user base in December 2016.Related (November 21, 2016): Instagram adding live video, ephemeral attributes ",-0.1526,negative,0.777874358974359
277,2017-01-18,0.05,How much did Facebook pay for Oculus?,"
Mark Zuckerberg disclosed that beyond the $2B price tag for Oculus, that was widely reported, Facebook (NASDAQ:FB) paid an additional $700M to retain employees and another $300M earnout for hitting key milestones.Oculus originally wanted $4B.The revelation came in a Dallas courtroom, where Zuck denied an allegation by ZeniMax Media that the VR technology of Oculus was stolen. ",-0.2066,negative,0.777874358974359
278,2017-01-13,1.72,Facebook upgraded to Strong Buy at Raymond James,"
Analyst Aaron Kessler moves from Outperform previously, noting Q4 checks indicate positively, potential for upside reporting in spite of debate over ad load and expense growth levels, and appealing risk/reward ratio relative to firm's model of around 24x/19x 2016/2017 EPS.Target maintained at $160. Facebook (NASDAQ:FB) +0.81% pre-market at $127.64. ",0.874,positive,0.777874358974359
279,2017-01-11,1.74,"Alphabet ended Titan solar-powered drone program, shifted focus to Loon, Wing","
Titan had been integrated with Alphabet's (GOOG, GOOGL) X division around a year ago, though in a statement today, the company notes ""exploration of high altitude UAVs for internet access"" had been terminated soon thereafter.Instead Alphabet expresses greater confidence in Project Loon, a network of balloons on the edge of space, considering the operation ""a much more promising way to connect rural and remote parts of the world.""Members of the Titan team have also been reassigned to Project Wing, where automated aircraft for various delivery applications (i.e consumer goods, medicine, burritos) comprise emphasis.While Alphabet has apparently exited the field for solar-powered unmanned aerial vehicles, such technology remains an area under concentration at Facebook (NASDAQ:FB) as that company pursues its own efforts to bring connectivity to remote areas of Earth. ",0.9682,positive,0.777874358974359
280,2017-01-11,1.74,Facebook creates Journalism Project,"
In effort to develop an expanded relationship with news organizations, Facebook (FB +0.5%) plans collaborations on products, creation of new story formats, local news initiatives, exploration of new business models and solutions, ongoing sponsorship of journalism and publishing conferences, a continued focus on hoax news and various other news media-related strategies through the Facebook Journalism Project.Introducing: The Facebook Journalism Project [announcement] ",0.8503,positive,0.777874358974359
281,2017-01-11,1.74,"Instagram Stories to get full-screen ads, business insight tools","
With 150M Instagram users interacting with Stories (introduced five months ago) daily and high engagement among those created by business accounts (one-third of most-viewed stories cited from businesses), the Facebook (FB -0.1%) operation is looking to monetize the feature through full-screen advertising.Targeting, reach and measurement features will accompany ad creation to increase relevance. These ads will begin testing with clients including Nike, General Motors (Buick), Netflix, Qantas and others, and expand more broadly across Instagram's user base in coming time.Instagram Business Tools additionally extends capability for users to view reach, impressions, replies and exits for specific stories.As competition with and similarity to Snap's (CHAT) primary Snapchat product continues to escalate, and revenue deceleration and decreasing ad load growth at Facebook remains under consideration, the new channel for advertising allocation prospectively represents a new area of notable focus for Facebook, Snap and advertisers alike. ",0.9755,positive,0.777874358974359
282,2016-12-15,0.36,Facebook updates on hoax news,"
Facebook (FB -0.2%) is rolling out further steps to stem the circulation of misinformation across its platform by flagging certain stories, determined by third-party organizations, as disputed, testing the addition of a new signal measuring how likely a story is to be shared, and making it more difficult for sources to financially benefit from such content.With the company looking to address a problem it doesn't desire to fix singlehandedly (""We believe in giving people a voice and that we cannot become arbiters of truth ourselves.""), the moves mark some of the early steps Facebook's taking to eliminate the issue from the conversation.News Feed FYI: Addressing Hoaxes and Fake News [blog post]Addressing Hoaxes and Fake News [Vimeo] ",0.8209,positive,0.777874358974359
283,2016-12-15,0.36,Trump-Pence transition team updates on tech summit,"
Noting discussion took place on the following topics – job creation for U.S. workers, removal of barriers preventing U.S. companies from doing business in other countries, U.S.-China trade dynamic and market access, tax cuts and repatriation of U.S. profits held overseas, bettering of physical and digital infrastructure, intellectual property rights protection, cybersecurity improvements, updates to government software systems, technology in schools, a need for greater vocational education opportunities, bureaucracy reduction and increased accountability in the government procurement process.Private sector players in attendance included Tim Cook (NASDAQ:AAPL), Jeff Bezos (NASDAQ:AMZN), Elon Musk (NASDAQ:TSLA), Satya Nadella (NASDAQ:MSFT), Larry Page and Eric Schmidt (GOOG, GOOGL), Sheryl Sandberg (NASDAQ:FB), Ginni Rometty (NYSE:IBM), Brian Krzanich (NASDAQ:INTC), Safra Catz (NYSE:ORCL), Chuck Robbins (NASDAQ:CSCO), Alex Karp (PALAN) and others.Suggestion for reconvening of similar meetings, prospectively on a quarterly basis, was furthermore offered.Full readout ",0.9593,positive,0.777874358974359
284,2016-12-15,0.36,Instagram records 600M users,"
Up from 500M in late June, 400M last September, and 300M in December 2014.A 100M portion of the updated figure is attributed to new users joining the service within the preceding six months alone.As Instagram evolves dynamically from its original form through the addition of Stories, live video, ephemerality and various other features since first launching in 2010, user growth remains highly responsive to the Facebook-owned (NASDAQ:FB) product.600 Million and Counting [blog post] ",0.9388,positive,0.777874358974359
285,2016-12-13,2.54,Mega-cap tech trading hot,"
Apple (AAPL +2.2%), Amazon (AMZN +2.4%), Microsoft (MSFT +1.6%), Alphabet (GOOG, GOOGL) and Facebook (FB +2.5%) are continuing to elevate through December, at this point respectively higher by 9.4%, 8.2%, 8.8%, 8.8%/9% and 4.8% on a 1-month term (November 14).Not the only movers in the space, high-profile companies ranging from IBM and Intel to Qualcomm, Oracle and others are also on strong momentum, with many names having fully recovered from a widespread sell-off briefly overcoming the sector earlier this month. ",0.8895,positive,0.777874358974359
286,2016-12-13,2.54,"Reuters: WhatsApp, Skype to come under new EU rules","
Popular online communication services such as WhatsApp (NASDAQ:FB) and Skype (NASDAQ:MSFT) face stricter rules on handling user data under new security laws slated to be proposed by the EU, according to a draft document seen by Reuters.Authorities want to extend some restrictions, which at present apply to telecom operators, to include internet firms offering online messages and call services, called OTT (Over-The-Top) services. ",0.9402,positive,0.777874358974359
287,2016-11-29,0.46,"Facebook Messenger, News Feed gain integrated gaming capabilities","
PAC-MAN, Galaga, SPACE INVADERS, EverWing, TRACK & FIELD 100M, Words with Friends: Frenzy and other titles to be playable as Instant Games within messaging conversations and News Feed (FB +1%).Score-based leadership, in-context chat and group thread conversation features highlighted.Instant Games to initially (today) become available in 30 countries on iOS and Android.Video 1, 2 ",0.4624,positive,0.777874358974359
288,2016-11-21,4.75,"Instagram adds live video, ephemeral attributes","
Live video capabilities coming to Instagram Stories (FB +2.3%), disappearing photo and video functions to Instagram Direct. 100M people are cited to use Stories every day, while 300M monthly are considered to utilize Direct.Representing a notable differentiation from Facebook's live platform, live broadcasts on Instagram are not accessible indefinitely and disappear once concluded.With Facebook increasingly expanding into live features associated with Snapchat (CHAT), Twitter [Periscope] (NYSE:TWTR) and other services, competition for user attention in the live arena only continues to tighten.Previously (November 10): Instagram setting up for live video ",0.8626,positive,0.777874358974359
289,2016-11-21,4.75,J.P. Morgan positive on Facebook share buyback,"
Analyst Doug Anmuth highlights Facebook's $6B repurchase authorization as a positive indicator subsequent company-issued caution on anticipated slowing revenue growth and higher expenses and investment, and amid matters involving ad metrics and ""fake news.""Considers resignation of Chief Accounting Officer independent of metrics miscalculations.Retains Facebook (NASDAQ:FB), higher by 1.5% early, with a $175 target and Overweight rating. ",0.5675,positive,0.777874358974359
290,2016-11-21,4.75,"Facebook expanding UK headcount, new London HQ under construction","
Overall employment in the UK to increase by 50% to 1,500 positions in 2017, when a move to a new central London headquarters is scheduled.A majority of the incoming roles are noted by Facebook (NASDAQ:FB) to comprise ""high-skilled engineering jobs.""Last week: Google expanding UK infrastructure with estimated £1B+ headquarters investment ",0.8246,positive,0.777874358974359
291,2016-11-17,1.45,"Piper Jaffray reissues Overweight position on Facebook, Amazon, Alphabet, Netflix","
On the post-election downtrend in the technology sector, Gene Munster, ""would be buying the fear priced into internet mega-caps,"" noting concerns over the incoming U.S. administration are ""largely extrapolated from sound bites that are unlikely to manifest."" Believes potential net neutrality rollbacks, H1-B visa limitations and other speculative headwinds to remain unrealized.Since Election Day – Facebook (NASDAQ:FB) -6%, Amazon (NASDAQ:AMZN) -4.5%, Alphabet -2.6% (GOOG), -3.3% (GOOGL), Netflix (NASDAQ:NFLX) -6.7%Further: ""Amazon, Alphabet, Facebook, and Netflix have clear, long-term tailwinds for revenue and earnings growth; in our opinion, on long-term valuation frameworks each looks attractively priced. Moreover, as investors roll their focus to 2018 estimates for their valuation frameworks these companies look remarkably attractive relative to broader tech and the market.""Concludes that ""long-term investors should use this pullback as an opportunity to buy long-term secular winners at discounted valuations."" ",0.9655,positive,0.777874358974359
292,2016-11-17,1.45,Facebook acquires facial image-analysis startup,"
    FacioMetrics, founded with ""all kinds of applications including augmented/virtual reality, animation, audience reaction measurement, and others"" in mind, has been bought, terms withheld, by Facebook.Where Facebook (FB +0.6%) plans to integrate the buy remains to be seen, though implementations across its portfolio as it seeks to improve interactivity through gesture and facial technology, and compete against similar features at Snapchat (CHAT) and elsewhere, can be reasoned. ",0.6718,positive,0.777874358974359
293,2016-11-15,2.12,WhatsApp finally launches video calling,"
WhatsApp (NASDAQ:FB) is launching free video calling for all of its one billion users (the service will be fully encrypted).It's pretty simple - one just clicks the call icon to make a voice call then selects ""video call"" to activate it.A major plus point of WhatsApp's video calling is cross-platform support, unlike FaceTime, which only works with Apple devices, and Google Duo, which isn't compatible with older versions of iOS. ",0.9533,positive,0.777874358974359
294,2016-10-28,1.6,Facebook begins testing new in-app camera features,"
In what initially appears much alike Snapchat's (CHAT) full-screen camera view.Though Facebook (NASDAQ:FB) has tested similar features across its various platforms before (Instagram Stories, WhatsApp, Messenger), the new camera functions are this time housed within the company's main app alongside News Feed.Rolling out today in Ireland, the feature is at this stage only in testing. A global expansion, however, is considered forthcoming. ",0.6802,positive,0.777874358974359
295,2016-10-28,1.6,European regulators press WhatsApp to suspend sharing data between Facebook,"
Continuing to highlight European regulatory concern around WhatsApp's updated policy focused on enabling greater sharing between the messaging service and Facebook's other properties.The Article 29 Working Party maintains ""serious concerns regarding the manner in which the information relating to the updated Terms of Service and Privacy Policy was provided to users and consequently about the validity of the users’ consent.""The party is now formally requesting Facebook (NASDAQ:FB) to hold on sharing user data ""until the appropriate legal protections can be assured.""September 27: Facebook ordered to halt WhatsApp data collection in GermanyAugust 26: WhatsApp's new privacy policy under inspection at UK regulatory agency ",0.9593,positive,0.777874358974359
296,2016-10-24,1.21,"Facebook, PayPal extend payments relationship","
Previously (September 12): Facebook's Messenger gets ability to natively process paymentsFeatured – PayPal (PYPL -2.1%) to become payment option for U.S. users across various Facebook (FB +0.8%) commerce services, including Messenger. PayPal and Facebook/Messenger account linking, Messenger notifications and direct payments within merchant bots on Messenger.Earlier (today): Intuit, PayPal expand payments integrationRelated (today): Google's Android Pay targets broadened reach through partnerships with Visa and Mastercard ",0.5131,positive,0.777874358974359
297,2016-10-19,1.54,"Facebook adds food ordering, appointment request, event ticketing and quote functions to Pages","
In addition to enhancing social recommendation and event discovery features.Food ordering – available on restaurant pages integrated with Delivery.com or SliceAppointment request – book via a business page, confirmation communicated through MessengerEvent ticketing – purchase of movie tickets powered by Fandango enabled directly on Pages; Ticketmaster and Eventbrite collaborations for other events further notedQuotes – request quotes from local businesses on participating business pagesFacebook's (FB +1.1%) on a mission to simplify tasks that are often facilitated through multiple products with singular features (i.e. recommendations, food ordering, ticketing, local business quotes etc.) by streamlining them across its own integrated network of platforms.N.B. (NYSE:YELP), (NYSE:GRUB), (NASDAQ:ANGI)Blog postVideoPreviously (October 7): Facebook introduces dedicated events app ",0.9476,positive,0.777874358974359
298,2016-10-14,0.06,Facebook's Oculus acquires low-power LED display startup,"
InfiniLED, an operation based in Cork, Ireland.The development of VR solutions balanced between efficiency and power has been spotlighted of late as the competition to produce a device with broader consumer appeal moves forward. Securing technology to reduce display power consumption (20x-40x cited by InfiniLED) is accordingly worth noting.InfiniLED utilizes micro LEDs that are selectively illuminated, drawing power only from active pixels. Various uses of the technology beyond VR and across other wearables, TVs and other end products are also not difficult to imagine.Oculus (NASDAQ:FB) has reportedly confirmed the deal, though so far further information on terms and future plans remain undisclosed. ",0.9782,positive,0.777874358974359
299,2016-10-14,0.06,Facebook becoming less relevant to teens - Piper Jaffray,"
Piper's teen survey shows declining Facebook (NASDAQ:FB) engagement, says Gene Munster - from 60% in the Spring to just 52% this fall. Fortunately, there's Instagram, and engagement there rose five points over the same time frame. Snapchat usage rose four points.Long-term monetization from Instagram should eventually top that of Facebook, he says, keeping his Overweight rating and $185 price target.Shares +0.4% premarket ",0.8854,positive,0.777874358974359
300,2016-10-14,0.06,Downey Jr offers to voice Zuck's AI assistant,"
It looks like Mark Zuckerberg has a gotten a voice for his AI robot butler after asking for suggestions on Facebook (NASDAQ:FB).""I'll do in a heartbeat if [Paul] Bettany [who voiced Jarvis in the Iron Man movies] gets paid and donates it to a cause of Cumberbatch's choosing...that's the right kind of STRANGE!"" Robert Downey Jr. replied.Zuckerberg's response: ""This just got real."" ",0.7815,positive,0.777874358974359
301,2016-10-12,0.17,"Facebook, Google among co-builders of Los Angeles-Hong Kong submarine cable network","
Alongside TE SubCom (TEL -0.4%) and Pacific Light Data Communication Co.Set to launch in the summer of 2018, the Pacific Light Cable Network will measure nearly 8K miles and once constructed, will register the highest-capacity transpacific route to date.With Facebook (FB +0.2%) and Google (GOOG, GOOGL) driving ever-increasing quantities of global internet traffic, a greater stake in the infrastrucutre faciliatting its delivery could yield distinct advantages going forward.Earlier: Nokia demonstrates new record undersea cable capacity ",0.9508,positive,0.777874358974359
302,2016-10-10,1.25,Facebook launches Workplace,"
Formerly known as Facebook at Work.The project had been in closed beta for more than a year, though Facebook notes 1K organizations so far utilize the service (India, the U.S., Norway, UK and France cited as top countries).As of today, worldwide availability begins for ""any company or organization that wants to use it.""With this move marking Facebook's (FB +1.1%) first major foray into enterprise, Slack (SLACK), Microsoft (MSFT +0.3%), Salesforce (CRM +6.6%), Atlassian (TEAM +0.7%) and others will be on watch going forward.Workplace, PricingLast week: Facebook introduces dedicated events app ",0.8462,positive,0.777874358974359
303,2016-10-10,1.25,"Morgan Stanley reissues Overweight Facebook rating, VR headway observed","
Following developments and presentations highlighting the technology at Facebook's (FB +1.2%) Oculus Connect conference last week.Although large-scale adoption and implementation of VR is not imminent, analyst Brian Nowak notes, ""VR is in the earliest innings with software/hardware barriers to clear (we put Oculus in FB's 10 year bucket), but the initiative continues to progress.""Price target of $160 (current pice $130.37) retained.Last week: Facebook's Oculus direction viewed favorably at Piper Jaffray ",0.8404,positive,0.777874358974359
304,2016-10-10,1.25,Another row over Facebook U.K.'s taxes?,"
Despite recording global profits of $6.2B, Facebook's (NASDAQ:FB) U.K. business ended 2015 with an £11.3M credit to offset against future tax payments, just months after pledging to stop funneling earnings through Dublin and contribute more to the Exchequer.The revelation will likely reignite the debate about whether the internet firm is contributing a fair amount to British coffers. It paid just £4,327 in U.K. corporation tax in 2014. ",0.8895,positive,0.777874358974359
305,2016-09-30,0.18,Facebook experimenting with Messenger feature alike Snapchat's Stories,"
Called ""Messenger Day"" and testing in Poland, where Snapchat (CHAT) is not as popular as Facebook's (FB +0.2%) Messenger service.Filters, photos, videos and 24-hour ephemerality cited.Facebook: “We know that people come to Messenger to share everyday moments with friends and family. In Poland we are running a small test of new ways for people to share those updates visually. We have nothing more to announce at this time.”With Facebook's having already added ""Stories"" to its Instagram product, a broader rollout of ""Messenger Day"" among Messenger's 1B+ users at some point in the future wouldn't' be surprising. ",0.8851,positive,0.777874358974359
306,2016-09-30,0.18,Facebook at Work set to launch on Oct. 10,"
Facebook at Work is set to launch on Oct. 10, TechCrunch says.The enterprise platform launched as a closed beta early last year.Facebook at Work competes against a host of other enterprise collaboration and communication products, from Microsoft’s (NASDAQ:MSFT) Yammer and Salesforce’s (NYSE:CRM) Chatter through to HipChat and Slack. Launching when many of these already have large and entrenched user bases will be a challenge for Facebook. On the other hand, its user interface is based on Facebook, which makes it instantly easy and familiar to use. ",0.9402,positive,0.777874358974359
307,2016-09-27,1.38,Facebook at Work said to be close to commercial release,"
A move from a presently free model to charging based on number of employees also reported, though exact figures have not been specified.Groups, News Feed, Chat, Events and Search features tailored for an enterprise environment have been in the works and under evaluation through an early adopter program of the platform for over a year.Meanwhile, separate enterprise productivity partnerships between Microsoft (MSFT +1.8%) and Workday (WDAY +1.6%), and Slack (SLACK) and Salesforce (CRM -0.2%) were just announced earlier today.Facebook at Work (NASDAQ:FB) ",0.8432,positive,0.777874358974359
308,2016-09-27,1.38,Facebook counts 4M advertisers,"
Up from 3M in March (+33%).Facebook COO Sheryl Sandberg highlights increasing time spent on mobile, increased mobile engagement and advancing mobile technologies enabling devices to do more (video, 360-degree photos noted) as contributing to advertisers' growing participation on the platform.The update comes less than a week after Facebook (FB +0.8%) took criticism for miscomputing average viewing time ad figures. ",0.8204,positive,0.777874358974359
